I will use the computer for gaming and I hope there would be a sharp display and a high refresh rate. The keyboard should be smooth and the CPU + GPU should be fast.	3	7	5	8	0
My old computer is not working and I need a fast and well built one.	4	6	3	8	3
Good specs would make the computer more powerful.	3	7	5	8	0
I am finding a laptop with a high performance-cost ratio.	2	7	3	3	3
I hope I can afford a fast computer.	3	9	2	3	3
My old computer doesn't work for me anymore and I need a sleek one which has good battery life and runs games perfectly.	3	7	3	3	0
My boyfriend needs a new laptop that comes with good screen size and touch screen capability.	3	9	3	9	3
I need a low priced mechine that is easy to setyp and sound greatly.	3	0	0	8	2
I need a computer to handle my school work so it should run fast.	3	9	3	8	0
For my gaming laptop, I want it to have a beautiful design. I also want it to comfortable and run fast.	3	9	3	8	0
My old tablet finally died and I need a new one that comes with the right price.	2	7	3	3	3
My next semester is coming and I am finding a new computer to cope with the work. The computer should play games easily with an amazing price.	3	2	1	8	7
I need a computer which can be opened as soon as possible and have strong wireless connection. I hope it will be portable. And I hope it runs fast on the programming.	3	7	2	8	4
I like computer with nice colour.	3	0	0	8	2
My old computer has stopped working so I need a new computer with good internal specs, also, it should be fast and have amazing battery life.	3	9	3	8	0
I need a new computer with high performance-cost ratio immediately because my old one is not working.	3	7	3	3	0
I need a high performance-cost ratio computer.	3	7	2	8	0
My old computer needs replacement and I need the new one to be lightweight, quick and economical.	2	6	5	4	3
I need a computer that works good for working and gaming without a high price. I need to take it around so I hope the finish would be matte and slightly rubbery. I need a good screen for me to work. For gaming, I need it to run most of my games successfully. I want it to boot fast and run Windows applications quickly.	3	9	3	8	0
I don't enjoy waiting so I need a computer that startup and shutdown fast.	3	9	2	3	3
I am going through a replacement of my old computer and I want the new one to come with good specs and great display colour. The keys should be easy to find. It should be upgradable and economical.	3	7	3	3	0
I need to replace my old computer so I need a new computer with excellent CPU.	3	5	2	9	3
I need a computer within my budget.	3	7	3	8	0
I want a computer with long battery life.	3	7	2	8	0
I got tired of using the old computer from office so I need a new, fast computer.	3	7	3	8	0
I like playing games so I hope the new computer can play games at high settings effortlessly.	3	9	3	8	0
I am finding a new laptop for myself that has a high performance-cost ratio.	3	4	0	2	3
I am buying myself a new computer that is fast and built solidly.	3	5	2	3	3
I use the computer for my personal use and I hope it won't heat up if overused.	3	9	3	8	0
My dream computer would the one with marvellous design, pleasing audio system and amazing specs.	3	7	3	8	0
The only requirement I have for my computer is it has to be easy to use.	4	6	3	8	3
I am using the computer for work so I need it to be fast and have bright colours.	3	6	2	3	3
I want a fast and responsive computer.	3	7	2	8	0
I need a fast laptop with good configuration.	3	7	2	8	4
My old computer needs a replacement and the new one should be easy to set up while running cool. The colours on screen should be good though.	3	7	3	3	0
I am finding a replacement for my old computer that a longer battery life is expected.	2	6	5	4	3
I want to have a new computer for myself. It should be slim and fast. The screen should be great, the keyboard should be tolerable and the touchscreen should be responsive.	2	7	3	3	3
I play lots of games and I'm finding a new computer that run fast of all my games. I also own a VR headset and I want it to work well with that.	3	6	5	8	0
I need a laptop with good build.	3	7	2	8	0
I need a light computer which can turn on fast and run cool. I need to have a good screen with it. I also need to have a decent battery life to get my work done.	3	7	2	8	4
I focus on the design of a laptop very much so a beautiful finish and a beautiful screen is a must. The keyboard and touchpad should also be good though.	4	7	3	8	0
My old laptop is not working and I am looking for a new one that is fast, portable and light.	2	6	5	4	3
My family and I need a fast computer with a high performance-cost ratio.	3	4	2	8	3
Price is an important element when I purchase a new computer.	3	2	1	8	7
I want some good-looking computer with good price.	3	3	1	8	3
I dislike bloatware so it's better to be none of them.	3	2	1	8	7
I need a recommendation of a handy and light computer for my sister.	3	4	2	8	3
I need a handy computer.	2	9	0	2	2
Our homeschooled kids need some computers with large screen for learning.	4	4	2	9	3
I need a light computer that holds my 3D programmes well.	2	6	5	4	3
I Skype with my friends so I need a good sound output so I hear them clearly. It should also be fast and light.	3	9	3	9	3
I want a powerful computer to come with a low price.	3	8	3	8	0
I need the computer to have high performance-cost ratio and low power consumption and heat.	3	7	2	8	0
I would like to have a light and fast computer.	3	7	3	8	3
It would be enjoyable to have a computer that is speedy with an amazing sound system.	3	2	1	8	7
I want a quick laptop with amazing display.	3	7	2	8	4
Speed is what I consider when purchasing a new computer.	2	6	5	4	3
I do coding and I want a computer with a nicely-spaced backlit keyboard with quiet keys. The display should also bright and it should boot up fast in a high performance-cost ratio.	3	6	3	3	0
Screen is the most important element to me so I want it to be sharp. Moreover, I want the computer to be light and compact.	3	7	3	8	3
The build quality has to be awesome in my computer. I also want the design and the price to be nice. It should have the best cooling and runs silently. The SSD should be good.	3	7	2	8	0
I am a software developer and I am finding a new computer that can run IDSs with no glitch in a low cost.	3	5	4	9	3
I need the computer to do well in gaming and editing, of course with a good price also.	3	7	2	8	0
I want a computer with good performance and low cost.	3	0	0	8	2
I don't want the computer to be heavy or look dull. I need it to be fast.	3	1	0	7	5
I am finding a new computer for my personal use that is slim and has a nice keyboard. The startup should be fast.	3	7	5	8	0
I hope my money is well paid for a high performance computer.	3	1	0	8	2
I need a light and fast computer with a high-resolution screen.	3	5	2	3	3
I like to stick to one brand while purchasing computer and this time I want one with unique look. I want it to look sturdy, slim and stay silent.	3	7	3	3	0
I need a light computer so I can carry it around.	3	9	3	9	3
I need a great computer for work that comes with a high performance-cost ratio.	3	7	3	8	3
I only have simple needs on my laptop so it just has to be lightweight and economical. The keyboard should be good though.	3	6	2	8	3
My last computer was still working but I decided to go for a faster computer which is reasonably priced.	3	7	3	8	0
I look into many reviews and all I want is a computer that is hast and cheap.	3	5	4	9	3
I need a good laptop with reasonable price.	3	9	3	8	0
I have a kid in school and I am buying him a new laptop with a chassis texture. I want the keyboard and numpad to be comfortable. The SSD should be speedy and the viewing angles should be comfortable for him. The battery ought to be decent for him. The fan must be whisper quiet.	3	4	0	2	3
I need the computer to be within reasonable price.	3	7	2	8	0
I am finding a new laptop for gaming and a short boot up time is expected.	4	8	3	8	0
I am not really a gamer but I need a computer that is fast and economical.	3	6	5	8	0
I am going back to college later and so I need a laptop with a huge screen and a number pad on the keyboard. Of course, the price should be good.	4	6	1	8	3
I need a replacement computer that would run mush faster.	3	7	3	8	3
I need a computer that is easy to get started.	3	7	5	4	0
My old computer needs replacement and I want a new one that has a nice screen and good keyboard.	3	0	0	8	2
I want a well-built computer.	3	7	2	8	0
I want a replacement for my old computer and I need a new one that comes with amazing build quality. For the specs, a good keyboard and wonderful display quality and resolution are expected. Moreover, the price should be reasonable.	3	2	1	8	7
I am new to gaming laptop and I want some really good red back-lit keys because that looks cool. Of course the computer should run games great, and I don't want to wait too long for the game to be loaded. I need some nice graphics on the computer. Accessible fan settings would be prefect for me.	4	8	3	8	0
Specs are important aspect that I look into when purchasing a new computer.	3	2	1	8	7
I hope the money I spent would be exchanged for a good computer.	3	2	1	8	7
I am trying to change my perfence in branding and I need a light computer.	2	5	2	3	3
I am buying a slim and lightweight computer for my wife.	2	7	3	8	3
I enjoy staying with a high quality brand and now I want a new computer with a good fingerprint sensor and a large amount of storage. It should be economical though.	2	7	3	8	3
I have limited budget so I need a new computer with great price.	3	6	2	8	3
I want the computer to run smoothly.	3	7	2	8	0
I am a student and I want to find a fast and light computer for my everday use. The display should have high resolution.	2	6	5	4	3
I need a computer that is light and lasts long for me to work at the coffee shop.	2	6	3	8	3
I want to play games well on a fast computer.	4	8	3	8	0
I am looking for a new computer that has a sharp screen and a fast hard drive. It should also be thin and light.	3	7	3	8	3
I am finding a fast computer that runs smoothly.	4	4	2	9	3
I am buying a new computer for my wife and so the computer should play games with no problems.	3	6	5	8	0
I am finding a new computer for myself that is fast and has high internet connection. I want it to be lightweight and loud. It would be good if it can install Windows automatically out of the box. One more thing, I want it to play games well.	3	9	3	8	1
I usually stick to one brand when it comes to computer and now I want a computer that runs cool  and be easily upgradable. I need the setup to be fast. I also want a responsive keyboard and quiet fan to enable the unit to run cool.	3	9	3	9	3
I need a good piece of computer with a low cost.	4	7	3	8	0
I am in need of a new computer that is fast and slim.	3	7	3	8	3
The computer I need is the one with high performance-cost ratio, while having good cooling and consistent performance.	3	7	2	8	0
Price is what I look into when purchasing a new computer.	4	6	1	8	3
I don't want to carry a heavy mechine around.	3	7	3	8	3
I want to purchase a computer that is portable and lightweight. It should turn on quickly with fast processing. The wireless connection should be strong though.	2	7	3	8	3
I am looking for a working laptop for myself and it should look good with a good feel of keyboard. It should also be quiet, lightweight and economical.	3	1	2	8	6
I need a computer for my work and I want it to be light and easy to carry for my meetings. Also, the battery life and screen should be good so I can show my clients my slides.	0	9	0	2	4
Our family computer needs a replacement and the new one should come with a right price.	3	1	1	8	6
I need to have the best use of money for the best computer.	4	7	3	8	0
I am new to gaming laptop and I want one that run flawlessly for games. Also, I want it to have great design and start up fast.	3	9	3	8	0
I am replacing my old laptop for a better-sized laptop.	0	9	0	2	4
A computer which can quickly download stuff is which I need. I also need large SSD and RAM to store things. However, I want it to be light and have a small screen. It's better if it has a built-in SD drive.	2	2	3	3	6
I am finding myself a new computer that is light and come with nice size. The battery should last long and be replaceable.	3	6	2	8	3
I need a laptop that fit in my budget with cool looking and ability to play games without issues.	3	6	3	3	0
I need a computer as a present for my little brother and he like it to be aesthetically pleasing and response fast. I just want the price to be reasonable.	3	2	1	8	7
I need a new computer to go to work so it should be fast and sturdy. I do love a good backlit keyboard.	4	8	3	8	0
I enjoy playing games and I want a new laptop that is good for gaming with a great price.	4	8	3	8	0
I am leaving my old computer for my family and finding myself a new computer that run games well.	3	2	1	8	7
My dream computer is a powerful laptop.	3	7	2	8	0
I don’t have much money so I need a computer that comes with a great price.	3	1	0	8	2
I want my future computer to have plenty of storage with a high performance-cost ratio.	3	7	2	8	0
I need a computer with a good hardware.	3	4	2	8	3
I am becoming a coder and I need a new computer that is sleek and has large storage space.	2	7	3	8	3
I am looking for a new computer that comes with a high performance-cost ratio.	3	6	2	8	3
My family is going to have a new laptop and we are looking for a fast one with great graphics. It should be terrific for playing games. The screen size and sound quality should be excellent.	3	7	3	3	0
I don't want to borrow my husband's computer everytime I need it so I am finding myself a new computer with a nice hard drive. Since the previous one doesn’t boast with a number pad, it would be nice if the new one include one. I don't have a huge budget for the computer.	3	3	1	8	3
I need a functional yet inexpensive model.	3	6	2	8	3
I depend on reliable resources to make up my decision on a new computer. The computer should be fast and last long. The ports should be easily accessible and the touchpad should be nice.	3	3	1	8	3
I do some light gaming and I am finding an economical computer.	3	2	1	8	7
I don’t want my computer to slow down so a no is for those bloatware.	3	2	1	8	7
I don't enjoy waiting so I need the computer to startup fast.	3	7	3	8	3
I am looking for the heapest option for my next computer which it should be fast and light. It should have good viewing angles and be easily expandable.	2	7	3	3	3
I am replacing my old computer which I want a new one that has cool design and beautiful display. It should also be light and well built.	3	7	3	8	0
I need a light computer that runs fast. For the keyboard, it would be better if it is back-lit. The USB port access should be great. The screen would be better if it has vibrant resolution. The battery life should be reasonable for a laptop. I want it to have a high performance-cost ratio.	3	7	2	8	4
Price is what I concern when purchasing a new computer.	3	2	1	8	7
I want to have a new computer that has a high hard disk capacity with an excellent price.	3	9	3	9	3
I won't expect too much for my new computer but a high performance-cost ratio is a must.	3	0	0	8	2
I want to change my old computer and I need a new one with a reasonable price.	3	5	2	9	3
I expect my new computer will be fast and reasonably priced.	3	9	3	8	0
I would carry my computer around so it would be great to be thin.	2	9	0	2	2
I need a computer that is good for multitasking.	3	9	3	8	0
I want a computer with good screen and fast booting. The FPS rates should be good as well as the wireless card. Hopefully there is a fast WIFI connection and a high performance-cost ratio.	3	7	2	8	0
My computer just recently broke down so I need a new computer immediately. I need it to be cheap and fast. The ports should also be acceptable.	3	6	3	8	3
We need a perfect mobile business laptop and it should be quick, light and thin.	2	5	2	3	3
A fast computer with a great screen resolution is what I need.	3	1	0	7	5
Illuminated keyboard seems cool to me.	3	6	2	8	3
I need a computer come up with the 2018 standard in sound output, keyboard and trackpad.	3	7	3	8	0
I enjoy playing games on my laptop so I hope the laptop do magnificent job of graphics and gameplay. All games should run smoothly on it and the audio quality ought to be good while gaming. I need to take it to schoold so a normal design is preferrable.	3	9	3	8	0
I have got some expectations on my new computer as I need an amazing monitor and a good keyboard.	4	8	3	8	0
I have been doing a lot of research on computers and I have been longing for a computer that is light and fast. For the keyboard, it should have an excellent layout and the keys should great when typing. I need a responsive touchpad. I hope the computer won't get overheat at all. For the screen, I want no reflection on it and it should have great viewing angles being crystal clear. I want the bootup time to be as short as possible. For the connectivity, I need it to do well in both Wifi and Bluetooth. The data transfer should be fast. For the specs, I need an outstanding SDD and enough space for my files. It would be better to feature a Wireless Display option. I want minimal amount of fan noise. Moreover, the camera and the speakers should be good with a decent price.	3	8	3	8	0
My old laptop is not working and I am finding a new one that has good amount of RAM and storage. It should play games well with a good price.	3	6	2	8	3
I need a computer with great build quality.	3	7	2	8	0
I want a light laptop which can startup fast.	3	5	2	3	3
I need an excellent choice for home working and it should be elegant and fast.	2	7	3	8	3
I want to play games with my friends so I need a new computer that can do well in that aspect.	3	2	1	8	7
I don't want to annoy others so I need a quiet computer.	3	9	3	8	0
I would use the computer for light gaming so I hope the computer would play games well.	3	9	3	8	0
As a college student, I am finding a sturdy computer with a nice revolving camera.	0	9	0	2	4
I like gaming so I need a laptop that run games well.	3	9	3	8	0
I am getting a new computer for myself and I need it to be good looking with a great price.	4	2	1	8	6
I want to have a laptop for out-of-town use and I want a budget-friendly computer that handle games with no issue.	3	6	5	8	0
I would look carefully with all the specs that come with the computer and I want it to boot up fast with a great price.	3	7	3	8	0
I need some recommendations for a computer that comes with a high performance-cost ratio.	3	1	2	8	6
I need a computer with good specs.	3	9	3	8	0
I tend to look at other's reviews before purchasing a computer and I want one that play games well and quietly.	3	7	3	8	0
I would be happy to receive a quality computer with my money paid.	3	7	3	8	0
A good touch screen should be installed on my new computer.	5	4	2	8	3
I want the computer to run fast while I am at school.	3	0	0	8	2
I am considering to change my old computer and the new one should be sleek. I want it to run smoothly with an easy viewing screen.	4	4	2	9	3
I have limited budget on my new computer so it should have a great price.	3	1	2	8	6
I am getting a new computer with impressing specs to play games well.	4	6	3	8	3
The computer I need would be the one with strong GPU and hardware. I want it to look professional and have a good fingerprint scanner and trackpad.	3	7	2	8	0
My old computer is sick and so I need new one that stays cool and quiet. I need a responsive keyboard and a loud audio output though.	4	7	3	8	0
I am finding a new computer with a great price.	3	0	0	7	4
I want to replace my old computer to a better looking computer. It should also be light and economical. The technical specs and speakers should be great.	2	6	5	4	3
I plan to place a new laptop in my home and it should be lightweight, fast and quiet.	2	6	5	4	3
My old computer is not working anymore so I need a cheap, pretty, new computer.	3	0	0	8	2
My old computer has broken down and I am finding a new one that is easily upgradable with a high performance-cost ratio.	3	7	3	3	0
I hope my money is well spent on a high quality computer.	3	2	1	8	7
I am not having a huge budget and so I need a computer with amazing price.	3	9	3	8	1
I am finding a new computer for myself that has responsive keys and a beautiful screen.	3	4	2	8	3
I am just a student so I need a computer with low price.	3	7	3	8	0
The computer should have both reasonable price and performance.	3	7	2	8	0
A nice fingerprint scanner should be included in my new computer.	2	7	3	8	3
An adequate screen should be installed on the computer.	4	2	1	8	6
I am findinging myself a better computer with competitive specs and budget price.	2	6	3	8	3
I need some good specs on the computer for my business.	3	9	3	8	1
