I would not expect too much for a mid-range computer and all I want is powerful graphic card and backlit keyboard. Besides, I want it to be fast, light and expandable. The exterior design should be nice, and the unit should be able to keep cool.	3	6	3	3	0
My wife wants to play more demanding games so she needs a computer that handles games well and quick. There should be tons of storage for her to store the games. The computer should also be thin and light. A great battery life is expected.	3	2	1	8	7
I am in need of a new computer and it should work fantasticly for games. I would like it to have a glowing red keyboard and good sound output. Graphics are also important.	3	7	3	8	0
My gaming niece wants some right specs for his computer.	3	7	3	8	0
I don't want an overheated computer so the cooling system should be quiet and efficient. I want the audio sound to be decent. Also, it should do quick boot up.	4	8	3	8	0
I have some expectations on my new computer that it should have a good processor with enough RAM.	3	6	3	8	3
I want to have a new computer that is lightweight, solid and has good specs.	2	6	5	4	3
I need a perfect laptop for my office work in which it should be small and handy.	0	9	0	2	4
I want a good-looking computer with an awesome keyboard. I also want it to have a precise trackpad, NVME slots and great USB-C charging. 	3	5	2	3	3
I am changing my old computer and I want the new one to be easy to upgrade with a high performance-cost ratio.	4	7	3	8	0
The computer I want should have a high performance-cost ratio and a comfortable IPS panel. I hope it is well built and durable. The keyboard would be better to be a back-lit red one and be comfy for typing.	3	7	2	8	0
I plan to do some laptop gaming so it should play games well and fast.	3	8	3	8	0
I will need a functional computer.	3	1	0	7	5
I want to change my old computer and I am finding a new one that is nice looking and has nice backlit keys. The screen should be sharp though.	2	6	3	8	3
I need a computer to do typical home computer work and it should be light and has a bright screen. I want it to startup quickly with impressive spces. The hard drive should also come with good size.	2	7	3	8	3
I want the computer to perform well in games and be perfect for upgraders.	3	7	2	8	0
I want to find a fast computer for my cousin.	3	9	3	8	0
I need a fast computer.	3	7	3	8	3
I need some good price for my computer as I am lacking money.	3	9	3	8	0
I do basic business application on my laptop so I need sufficient amount of RAM and large drive of my data. I also need it to handle my task quickly. I would be grateful if it includes separate buttons for left and right click as my previous computer didn't. The computer have to stay within the budget of my company.	3	5	4	9	3
I hope my money is well spent on a powerful computer.	3	0	0	8	2
I need a new computer that comes with a good price.	3	7	3	8	0
I am a college student so I need a cheap computer which can last long for battery life.	3	9	3	8	0
I need a computer with great performance and cost.	0	9	0	2	4
A reasaonably priced computer is what my wife needs.	3	2	1	8	7
I need the computer to be light enough that I can carry it around.	2	7	3	3	3
I need a fast and lightweight computer.	2	7	3	3	3
I am taking the recommendations from my friend to find a new computer from Amazon. I want it to contain beautiful graphics and multi purple backlit keys. It should be able to refresh games fast and provide a good trackpad.	3	7	5	8	0
I am trying to find a new gaming laptop that plays my games fast and quietly. I also want to have a cool back-lit keyboard.	3	9	3	8	0
I need a computer that run any games well.	3	6	3	8	0
I am finding a budget gaming laptop that a responsive and nicely backlit keyboard is a must. The trackpad should also be responsive and large. I do hope there would be a bright display.	3	7	3	3	0
I hope the new computer meet up my expectations with the money I paid.	3	2	1	8	7
I play games so I need a laptop to perform well in those.	3	8	3	8	0
The computer I need should have a high performance-cost ratio and be solidly constructed. I want to feel premium while using the computer.	3	7	2	8	0
I am looking for a computer that play games well with a reasonable price.	3	7	3	8	0
I need to change my old laptop and I need one that run quietly and cool. I need to perform games well with a relatively low cost.	3	7	3	8	0
The old computer doesn't have a touch screen so there should be one on my new computer. Moreover, the Bluetooth connection should be excellent.	3	9	3	9	3
I am planning to buy a laptop for my son and he wants it to be lightweight and nice looking. The screen should be nice also.	2	7	3	8	3
I am finding a replacement computer and it should be fast, light and easy to use.	4	6	4	8	3
We need a new laptop for CCTV management and it should bootup fast and have a good battery life. A sturdy keyboard is a must.	3	7	3	8	3
I need everything to be fast including the startup and operating.	3	7	3	8	3
I can't use my old computer anymore and I need a new one that is fast and reasonably priced. An awesome keypad is also needed.	3	2	1	8	7
The computer should be light.	3	7	2	8	4
I am planning to replace my old computer and the new one should come with high performance-cost ratio. The battery life should be good and the display should have high quality. It would be great if the brightness is adjustable for the backlit keyboard.	2	6	5	4	3
I am in need of a new computer that has a good processor and a practical appearance. It should have less bloatware that my previous computers and be lightweight.	3	6	2	8	3
I am finding a computer for myself that show vivid colours and brightness. The build quality should be good with a responsive touchscreen.	2	9	0	2	2
I look into graphics so I need a computer that can handle heavy graphics.	3	9	3	8	0
I like computer that feels classy and sleek.	3	6	3	8	3
My husband wants a faster computer that his current one.	3	2	1	8	7
I need the processor to be fast and responsive on my next computer.	3	7	3	8	3
I am trying to find a new computer that comes with good design and light weight.	3	6	3	8	3
My son has some suggestion for me on the new computer and all I want is a big screen.	2	9	0	2	2
My old computer is too slow so I want a new one.	3	5	2	9	3
A light computer is what I need.	3	2	1	8	7
I am finding for a gaming laptop that startup fast and last long with a reasonable price.	3	6	3	3	0
Speed is what I concerned when buying a new computer.	5	4	2	8	3
My old computer doesn't work for me anymore and I need a fast one with lots of space.	3	0	0	8	2
I major in Computer Science and I am finding myself a quick computer.	2	6	5	4	3
I have some criteria for my dream computer. For the size, it should be a small and light computer. For the price, I hope it won't be too high. For the content, I want it to have a high expandability and can handle heavy duty work loads with a solid I/O options. I don't want the computer to go overheat while performing the jobs. For the design, I prefer a sleek and neutral one. For the battery, I need it to be long enough to support my work. For the hardware, I need a great display panel, a sturdy keyboard with great typing experience and keys with red LEDs as the backlit.	3	7	2	8	0
I need a state-of-the-art laptop that comes with a low price.	3	4	2	8	3
I work all time on computer so I am finding a new laptop that is fast, sleek and flat. The finger pad should be sensitive, and the price should be reasonable.	3	2	1	8	7
I need a new computer that is easy to setup with a high performance-cost ratio.	3	0	0	8	2
As a responsible student, I am finding a big and full sized laptop to bring to college. The keyboard should be cool and the display should be nice. The gameplay should be smooth for me in a decent audio volume. Moreover, it should be quick to charge.	3	7	3	3	0
I am buying a laptop for my brother who just entered into college and the amount of storage ought to be more than enough.	3	9	3	9	3
I need a computer to write my master's papers so I need it to be light and portable to take it around. It should be running fast so I can finish my papers on time. For a better typing experience, I would need a great touchscreen and a responsive keyboard. Good resolution is also needed to protect my eyes.	3	6	3	8	3
I want the computer to stay within a reasonable price range, having a sensible fingerprint sensor and large amount of storage.	3	7	2	8	4
I did a lot of researching and I need a new computer that is fast, cheap, light and slim.	3	7	3	8	3
I need a computer that can run my games fine and do editing. I also need it to have a clear screen and a decent battery life. Of course it should have a reasonable price.	3	7	2	8	0
I am taking the laptop to school and I want it to do fast in typing responsiveness and log in time.	2	7	3	8	3
I need a new work station that is fast, light and good looking. The screen should be huge though.	3	7	4	3	1
I want to buy a new laptop so I can share it with my wife. The computer should have nice colour option and design. As it is for my wife, it should be light. The keys should be responsive and the screen should sharp. I don't want it to be too expensive.	3	0	0	8	2
I need a new laptop for work and it should be affordable, fast and sleek.	3	7	3	8	3
I need a real fast computer.	3	6	2	9	3
I do a lot of professional tasks so I need a computer that run tons of programmes well with a fair price.	3	2	1	8	7
I am going to find a new computer for long-term use. I would like a reassign of the Fn keys to make it look special. The speakers should be nice and the screen should be bright enough for indoor use. I need the price to be reasonable.	3	3	1	8	3
I don't want to have much bloatware on my computer.	3	3	1	8	3
I need a fast computer.	2	2	3	3	6
My old computer needs replacement and I hope the new one comes with great specs and run smoothly.	3	7	3	8	0
I am new to laptop and I need a laptop that has a good touch screen and a big hard drive but a good price.	5	4	2	8	3
I pay many effort into investigating computers and now I want a sturdy and portable one. The keys ought to be tight and accurate. The trackpad and screen size should come ideally.	2	7	3	3	3
A fast computer would be preferrable.	3	3	1	8	3
I need a fast computer.	3	7	2	8	4
It is time to replace my old computer to a quicker one with a better performance-cost ratio.	2	7	3	8	3
Our old computer are not fast enough so we need some new one with higher performance-cost ratio.	3	7	3	8	3
I am finding a replacement for a higher performance-cost ratio.	3	8	3	8	0
I need a computer with good processor.	2	6	3	8	3
What I need for school is a fast computer.	3	7	3	8	3
I don't work on my old computer nowadays and I need a computer with bigger keys and better keyboard. The touchscreen should be better too. I want the computer to be sturdy with a nice texture. The battery should have the best life and do fast charging.	3	5	2	3	3
I do video editing so the computer should work great with that.	3	6	3	8	0
I am changing my old computer and I want a new one that is faster and more economical. There should be lots of memory.	3	6	2	9	3
I don't want the new computer to constantly lag as my previous computer.	3	7	3	8	0
I need a computer that runs silently with a good battery life, also it should stay within my budget.	3	7	2	8	0
I need a computer that stays within my budget.	3	1	0	7	5
My old computer died so I need a new one immdiately with good picture and sound in a right price.	4	6	4	8	3
A nice packaging and good looking computer would be nice for me.	3	5	2	3	3
Speed is important to me when purchasing a new computer.	3	6	2	8	3
I need a great screen to better do my spreadsheets.	2	7	3	8	3
I am finding something new to replace my old computer that has a higher portability and better display. The fan should run quietly. The display should be matte with a good viewing angle.	3	7	3	8	3
I care about gaming experience so I want a computer that play games with no problem.	3	5	4	9	3
I want the new computer to come with a cool touch screen.	3	4	2	8	3
I am finding a fast computer.	3	1	0	8	2
I need a light computer that is perfect for my business.	3	7	3	8	3
My computer should be fast and accessible, and should have a good graphic performance.	3	7	2	8	0
I need a computer that comes with a slim profile DVD burner.	4	6	1	8	3
I am purchasing a new computer mainly for gaming so it should play games smoothly and have a gorgeous screen.	4	8	3	8	0
My step son wants a computer with not much bloatware. He does mostly for gaming so a bright screen, fast refreshing, a decent keyboard and loud speakers are all the things he needs. I do hope the price won't be too high.	3	7	3	8	0
I like taking my laptop around so I like it to be light and good looking.	3	2	1	8	7
I do a lot of gaming and I am in need of a new computer that perform well in that aspect. I also like to have lighted keyboard with a great price.	3	7	3	8	0
The computer I will be using should be light and have thin edges. It should also have long battery life. Good processor, good RAM and good hard disk should be installed. The computer should also be fast and modulable. I also hope the sound output and the quality of image to be great. The computer should also run quietly.	3	5	2	3	3
I am looking for a nice computer with a low price for everyday use.	3	9	3	9	3
Price is what I look into when purchasing a new computer.	3	2	1	8	7
I don't know if I would bring the laptop outside but anyway being lightweight isn't bad.	3	9	3	8	1
I want something that is simple to use because I don't know much about laptops.	3	6	2	9	3
I am looking for a Mother's Day present that is easy to setup.	3	0	0	8	2
I got to use a lot of graphics and processing-heavy programmes so I hope the computer has no issues with them. It should startup fast without being overheat. I hope there will be clear display and sound. The battery life should also be long to support my work.	3	9	3	8	0
I am buying something from the Black Friday Bargain and I want a new computer that comes with good picture and good sound quality.	3	9	3	9	3
I want to get a computer that is slim, light, fast and great looking.	2	7	3	8	3
I am finding a nice computer that would fit my budget.	3	6	2	8	3
I like sleek looking computer.	3	2	1	8	7
I am buying the computer for my family so I need a nice screen to protect their eyes.	3	1	0	8	2
I need a good computer with good price.	3	2	1	8	7
I need something to bring to work and I hope it would be thin, light and sturdy.	3	6	3	8	0
I am looking for a computer with an excellent sound output.	3	7	3	3	0
I don't really have huge budget and all I want is an affordable computer that can play games well. Moreover, I want it to be fast and fashionable.	3	7	3	8	0
As a fairly active gamer, I need a computer that is solid and bootup fast. The wireless connectivity should be good as well.	3	8	3	8	0
As a student of Systems Engineering, I need a fast and portable computer to get my programme done. The build quality should also be excellent.	2	6	5	4	3
I do a lot of travel so I am finding a slim computer that can do well at that.	2	6	5	4	3
I am changing my old laptop and I want a fast one that is well designed and great for gaming.	3	7	3	8	0
I do play some kinds of games and I need a new computer that work the games perfectly. A wonderful screen should come with an excellent price.	3	2	1	8	7
I did a lot of research on my new computer and my wish is to have a fast computer that play games well.	4	8	3	8	0
I am lacking money currently but I need a computer with nice price.	3	7	3	8	0
The display must be incredible on my new computer.	3	3	1	8	3
I am finding a work only computer that is fast and has plenty of memory.	3	9	2	3	3
A good hard disk with a reasonable price is what I need.	3	9	3	9	3
My past laptop just died a few days ago and I am in urgent for a computer that is well balanced for the price.	3	7	3	8	0
I am looking for a high quality computer with a great price.	4	6	4	8	3
I need to change to a new computer and I want it to have high portability, good display and good battery life.	2	6	5	4	3
I want a new gaming laptop that play my games well with a good price.	3	6	3	8	0
I want an amazing touch pad for my computer.	3	9	3	8	0
The computer should have a high performance-cost ratio.	3	6	3	8	3
I am not finding a fancy computer but a powerful computer with a low cost.	3	5	4	9	3
I need a new notebook and I want it to be light and easy to use.	5	4	2	8	3
My desire computer should own a great keyboard and a powerful cooling system. I also expect a good IPS panel.	3	7	2	8	0
I need to have a decent computer with a decent price.	3	7	3	3	0
Speed is the particular area I look into when purchasing a new computer.	4	8	3	8	0
The computer should be light.	3	5	2	3	3
My old computer needs replacement and I am finding a thin one with awesome design.	3	7	5	8	0
I'm an IT student and I need a computer that looks cool.	3	7	3	8	0
My old computer is not working and I need a new with good size and colour.	3	0	0	8	2
I need a new laptop for grad school and it should be fast and sturdy and great looking. I hope the battery stay excellent and keep cool. The screen should be sharp and light. The touchpad and keyboard should also be good. It would be better to be upgradable.	2	5	2	3	3
My old computer is too slow so I need a faster and lighter one.	2	6	5	4	3
I have a lot of things to be done so I need a quick processor on my computer.	3	2	1	8	7
The computer should have great build quality and specs, but also with a good price.	3	7	2	8	0
I want a faster computer than my old ones.	3	5	2	9	3
I would use the computer with my children so I need it to be light and sturdy. The hinges should be good. I want it to be natural when I am drawing on it.	2	9	0	2	2
I am planning an upgrade for my wife and she needs it to be lightweight and fast. The screen should be brilliant. There shouldn't be much bloatware.	2	5	2	3	3
I am considering to change my old computer and what I need is a computer with a high performance-cost ratio and long battery life. I also want it to look good.	3	9	3	8	0
I look into various factors while buying my new computer. I want good hardware and good display to go with it. I also need nice keyboard and trackpad. A decent battery life is also needed.	3	9	3	8	0
I would like to have a new computer that has great colours.	3	0	0	8	2
My grandson wants a new computer that would be great for gaming.	3	2	1	8	7
I am going to find a fast computer for myself.	4	7	3	8	0
I am finding for a nice laptop that is slim and fast. The connectivity should be good. I don't want my eyes to be hurt so a non-glare screen is important. The keys should be chiclet though.	2	6	5	4	3
I draw on my tablet so a style pen is a must.	2	9	0	2	2
I want to spend as less as possible on my new laptop.	3	9	3	8	0
The computer I want should handle all my needs with a good price.	4	6	4	8	3
I have got a lot of documents from my work so I need a new computer that can store all those files with a reasonable price.	3	0	0	8	2
I need the laptop to look much as a PC so it should have a full keyboard and a good touchscreen.	3	6	2	9	3
As a college student, I am finding an affordable laptop which has a solid construction. I need it to be fast and come with a DVD drive. The screen should at least be HD and I hope the battery life would be long enough for my papers.	3	3	1	8	3
I do a lot of typing work so I hope the surface would be comfortable to rest my hands on. Also, I like a sleek laptop with a responsive mousepad and keys. Not to mention that the specs should be wise.	3	9	3	8	0
I am not into waiting so I need a computer that do fast bootup.	3	7	3	8	3
I need a Christmas present for my girlfriend and she wants a laptop that boot up fast and can be set up easily. The graphics should be amazing.	4	4	2	9	3
I don't have much requirements for a new computer but I need it to run fast and setup easily.	3	2	1	8	7
I am buying a laptop for my daughter and she wants it to be lightweight with a high performance-cost ratio.	3	9	1	8	3
I don’t want my current computer anymore and I am looking for a new one coming with the perfect keyboard and screen.	2	6	5	4	3
My old computer is too slow so I need a new one.	3	7	3	3	0
I am replacing my old computer with a lighter one. The setup should be fast, as well as the charging. The screen resolution, flip function, touch screen, keyboard, etc. should be good.	2	7	3	3	3
A good looking computer with a great price is what I need.	2	7	3	8	3
I need a computer that is easy to setup and come with a high quality monitor.	4	2	1	8	6
I travel a lot so I would like to have a sturdy and handy laptop.	0	9	0	2	4
I am changing my old computer and I want the new to be quick, responsive and economical.	3	7	3	8	0
I am sensitive to sound so I want the best sound quality on my computer.	3	6	3	8	0
I did a lot of research and found out having a sharp display is critical to me.	3	7	3	8	3
I have a number of games that I would like to try on my new laptop so it should have a large storage that is great for gaming.	4	8	3	8	0
My old laptop needs replacement and I need a new one that has beautiful laptop design and accommodating screen size. It should be lightweight including backlight features.	4	4	2	9	3
For my games, I need a high contrast on screen to make it looks good. Moreover, I need it to come with a strong case.	4	7	3	8	0
Out of all the features, colour is the aspect that I pay most attention on.	3	0	0	8	2
I am finding a solid computer with a lighted charger.	3	7	3	8	0
I am finding a new laptop that is solid, quick and economical. The graphics and CPU performance ought to be great.	3	7	5	8	0
The computer I want should run intense games perfectly and have a high performance-cost ratio.	3	7	2	8	0
Once I find a computer that fits my needs, I am willing to spend the appropiate amount of money.	3	7	3	8	0
I need a different computer from my current computer, which is slow and heavy.	3	7	3	8	3
A lightweight computer is what I need.	3	1	3	3	5
We are finding a new computer with a reasonable price.	4	4	2	9	3
My regular computer needs repairment so I am finding a new one with nice display in a low cost.	4	6	3	8	3
I am in need of a new computer that is sleek and compact.	2	6	3	8	3
I want a compact computer which can do fast browsing.	0	6	0	2	2
The computer I want should handle my games with ease and run super fast. I need it to be quiet and have a great battery life also.	3	7	2	8	0
I am finding the best computer with my limited budget.	3	1	0	8	2
I want a aesthetically beautiful so I would be happy to carry it around.	3	2	1	8	7
I need some great specs for my computer.	3	8	3	8	0
I want to get to use the computer as soon as possible so it's better to have some pre-loaded software.	3	5	2	9	3
I am looking for the best computer with the best price.	2	6	3	8	3
I do photo editing and I am finding a computer that boot fast and run quietly. I hope there is plenty of storage with a good price.	4	7	3	8	0
I want to have a new computer that is easy to setup. The speakers should be good though.	4	6	4	8	3
I want a computer with high performance-cost ratio.	3	7	2	8	0
I need a new computer for myself and I want it to come with superb build quality. The screen should be good and the clicks should have nice tactility. I hope it would be sleek and economical.	2	6	5	4	3
A nice looking computer would be suitable for me.	3	9	3	8	0
I work in IT for a living and I am buying myself a economical computer that does not have a reflective screen.	3	8	3	8	0
My old computer doesn't work for me anymore and I need a responsive one with high performance-cost ratio.	3	6	3	8	0
I need a computer with a high performance-cost ratio and a large memory. I want the computer to boot up quick and last long for the battery.	3	7	2	8	4
I am looking for a replacement of my old computer which I require it to have a high performance-cost ratio. The processing power should be good and there should be plenty of memory. I hope the screen is sturdy with good brightness range.	3	3	1	8	3
I would have the tablet for office use so it should be easy to use.	2	9	0	2	2
I want to have a new computer for myself and I need to to be sleek, light and easy to use. The design should be good though.	2	6	3	8	3
My girlfriend needs a computer that has a good design and a high performance-cost ratio.	2	6	3	8	3
All I need on a computer is high bootup speed and great graphics.	3	9	3	8	1
I want a computer that runs fast.	3	7	2	8	0
I want a computer that bring up my application quickly and I can work on a large screen with sharp imaging. I would also look into the design, which I hope it to be light, slim and attractive.	3	7	2	8	4
I want a high performance-cost ratio computer with a good fingerprint scanner and good keyboard backlighting. I need it to play games well at a low temperature and long battery life.	3	7	2	8	0
I am buying a new laptop for my daughter's graduation and it should be fast and have beautiful colours.	3	3	1	8	3
A good design and a cool keyboard should be applied to the computer. The keystokes on it should be comfortable to type on. It would be better if the speakers and fingerprint reader are in good situation. I hope the price wouldn't be too high for all the above features.	3	7	2	8	0
I am looking for a computer that fulfil my data science demand and it should come with an awesome keyboard.	3	7	5	8	0
I don't have much money so good price is important for a new computer.	3	9	3	8	0
The money I paid should be exchanged for the best computer.	3	4	2	8	3
I am finding myself a great computer that is solid and priced greatly. For the keyboard, I need the keys to be good typing, and it's better with backlight.	2	6	5	4	3
I am finding a new computer with amazing boosted frequency and useful amount of RAM.	3	5	4	9	3
The computer should be slim, light and looking good. Of course, it should run fast for me to use.	3	7	2	8	4
I need the computer to handle games well.	3	7	2	8	0
One of my flight attendent mentioned she wanted a light computer.	0	9	0	2	4
I need a nice looking computer.	3	9	0	7	2
