I don't have a big budget so I need a computer that comes with a good price.	2	7	3	3	3
The computer I need is the one which can be opened up and upgraded easily and have a good build quality.	3	7	2	8	0
I am trying to find a gaming laptop that goes really fast.	3	9	3	8	0
I want to have a new gaming laptop and I want a nice display to come with it. I also want it to be responsive, quiet and light.	4	8	3	8	0
I am looking for a quiet computer with a good price.	3	7	3	8	0
I am purchasing a new computer and I want it to have good hinges because I broke those of my last computer. A good graphic card and lots of RAM would be good for me to do gaming. I don't like backlight on the keyboard because that would harm my eyes. The computer should not be too heavy for me. Last but not least, I don't want to spend too much on it.	3	2	1	8	7
The computer should be light for me to carry it around. I need a good SSD and HDD combination for speed and power. I need good keyboard, touchpad and fingerprint scanner.	3	7	2	8	4
I don't play many games but I still hope the computer would play games well.	3	9	3	8	0
My wife needs a new computer and I am planning to gift her one that have nicely arranged keyboard and low cost.	3	2	1	8	7
I am in need of a new computer that is fast, sleek and economical. The speakers have to be good though.	3	9	3	8	1
I need a computer for everyday use that comes with a high performance-cost ratio.	3	7	3	8	3
Specs are what I look into when buying a new computer so the keyboard and trackpad must be decent.	3	9	3	8	0
I am looking for a new laptop that is fast and comfortable to type on. I hope there won’t be much bloatware.	3	5	2	3	3
The computer should boot up and connect to the Wifi in a super fast way, but I don't want the price to be too high and the diplay should be great also.	3	7	2	8	4
I got many good years on my old computer and now I am changing to a faster model with a good touch screen and a good screen size.	3	9	3	9	3
My wife and I want to change the computer of our home and we are finding a computer that works quietly and fast. A good touch screen is also necessary.	3	6	3	8	3
I cannot put a thick laptop into my bag.	3	7	3	8	0
I need a engineering work station so the computer should be fast.	3	9	3	8	0
I need a good gaming laptop.	3	7	2	8	0
I want a computer that is able to run games at a high-ultra setting without getting too hot.	3	7	2	8	0
I need a computer that comes with a high performance-cost ratio.	3	2	1	8	7
I am finding a fast laptop with a high performance-cost ratio.	4	4	2	9	3
I am finding a new computer for myself. I need it to be fast and have great battery life. If there are plenty of ports, it would easy to upgrade. I also want the computer to be substanial with a brushed look. A good keyboard is also important.	3	3	1	8	3
A quick and responsive computer is what I need.	2	7	3	8	3
Computer is my business and I am finding myself a computer with high performance-cost ratio.	3	9	3	9	3
I need a fast computer.	3	3	1	8	3
I am on budget gaming but I need a computer that turns on quickly.	3	2	1	8	7
I am new into computer gaming and I want something that runs smoothly with reasonable price.	3	6	5	8	0
I want to play games on my new computer so it should response quickly.	3	9	3	8	0
My old computer is too slow and heavy so I need a new one.	3	7	3	8	3
I have just retired and I am finding a computer for my personal use. I would like to have a laptop with a tablet PC form factor. There should be a fast storage. The battery should last long and run cool. I need an optimum screen size and a reliable touch of the laptop. The should also be enough ports for connectivity and an expandable RAM. The access to Internet should be fast. For the specs, I need a fast fingerprint reader and a backlit keyboard.	3	5	2	3	3
I use a laptop when I go to school and I need a fast one.	3	7	3	8	3
I am in college and I need a sturdy and solid computer that comes with a high response rate.	3	7	3	8	0
My wife need a computer to do her college work and she needs it to bootup fast and play games well.	3	7	3	3	0
For my meetings, I need a light computer with a long battery life.	2	5	2	3	3
I need an upgrade from my old computer that I want a better processor and a decent GPU. I also need a decent upgradability for further upgrade.	4	7	3	8	0
I need a good looking computer which stays within my budget.	3	7	2	8	4
I am finding a replacement for my old computer and the new one should be light, solid and has a long battery life.	2	6	3	8	3
I need the computer to perform great in gaming.	3	7	2	8	0
I play games on laptop and I am finding a professional computer for that.	3	7	3	8	0
I am replacing my old computer that I want a full sized keyboard with a number pad. The processor and cooling fans should be effective. I want the trackpad and speakers to be good also. There should not be a lot of preinstalled bloatware. I don't want the cost to be high though.	3	6	3	8	0
I am lacking money but I need a new computer that comes with a perfect price.	3	9	0	7	2
I surf the internet all day and I am finding a new laptop that do fast in that.	3	1	2	8	6
I need a thin computer with an appealing design and a light weight. I need it to perform well in running small applications and programming. I hope the keyboard is light-up and easy-to-type.	3	7	2	8	4
I am using the laptop for small projects and I hope it has an appealing design and litup and easy-to-type keyboard. I want it to be lightweight thin. It should perform small applications well.	2	7	3	8	3
I do spreadsheets all day and I want to find myself a computer with a high performance-cost ratio.	3	9	3	8	1
I am finding myself a new computer that is fast and solidly built.	3	9	3	9	3
I want to have a new computer that is easy to setup and produce good sound.	3	9	0	7	2
I would use the computer for gaming and home schooling so I hope it's well built with a reasonable price. Also, I need easy access to RAM and hard drive.	3	9	3	8	0
I need a fast computer.	3	7	2	8	0
Price is what I consider when buying a new computer.	3	3	1	8	3
I need a new computer that is fast and well priced.	3	5	2	9	3
I am finding a new computer that have good specs but low price.	4	2	2	8	6
I need a computer that immdiately wakes when I use it. It would be better if it allows others to borrow my computer but not my account. The computer should have a long battery life and can be intergrated with my phone. Hopefully there is no system administration or virus software needed. It would be convenient if it doesn't need a transfer of files. I hope the computer would be secure to use, easy to use and simple to use.	3	9	0	2	2
I am changing my old computer that I want a faster Wifi connection and bootup time. The price should be fair with a nice display and a great colour depth on it.	2	7	3	8	3
I am buying a new computer for my relative and he needs a good CPU to play games well.	3	6	3	8	0
I am a student and I am finding an affordable computer that looks great.	3	0	0	8	2
I want to have a computer that would fit into my bag.	3	3	1	8	3
I do pay attention to user response on computer and I am finding one that is quick, light and slim. The bezels should be narrow for the screen to show sharp images.	2	7	3	8	3
I don't have much money so I would need a computer with reasonable price.	3	6	3	8	3
I need a replacement for my recently died computer and I want it to be easy to setup the new computer.	3	6	2	9	3
As a college student, I don't have high expectations on a cheap computer. It just need to have nice build quality.	3	2	1	8	7
I don't have a huge budget so the new computer should be cost-effective.	3	2	1	8	7
What I expect is a good computer with a high performance-cost ratio.	3	7	3	3	0
For an everyday use computer, I need it to have good colour with great price.	3	0	0	8	2
I have a few points to note for a perfect laptop. The build quality ought to be amazing. It shouldn't look too fancy, and the key placements should be good.	3	7	3	8	0
I have tried multiple brands and this time I am finding myself a portable computer.	2	6	5	4	3
I am planning to replace my old computer and I need the new one to run games fabulously. It should startup fast. Aesthetics seems important to me. The keyboard would be better to be lighted up. A good graphic card should come with a low cost.	3	8	3	8	0
I normally connect my laptop to my tv for gaming and I hope the new laptop do great in that, without being overheated.	3	7	3	8	0
I am changing my computer of many years to a thinner, lighter and sleeker version. I need to the setup to be easy to follow. I want some nice features including facial recognition and touch screen. The battery life has to be good which can be charged quickly.	2	7	3	3	3
Our mechanic said he needs a laptop that has a high performance-cost ratio.	3	0	0	8	2
I am not having much money at the moment and what I need is a computer with a reasonable price.	3	0	0	8	2
I hope it would be easy to setup right out of the box.	3	9	3	9	3
I am going to buy a new computer and I want it to startup fast with a reasonable price. I have some programes to be installed so the DVD drive should work well.	3	1	3	3	5
I want a computer that is lightweight and fast.	5	4	2	8	3
I need a computer with high performance-cost ratio.	3	7	2	8	0
I need a computer that coordinate well with my iPhone.	3	9	3	9	3
I am saving money so I want a well priced computer.	3	1	0	8	2
My old computer was on fritz so I need a new computer that is quick and easy to setup.	3	7	3	8	3
I want a computer with a high performance-cost ratio, yet it should have efficient cooling and run quietly. Hopefully the build quality is premium.	3	7	2	8	0
I need the computer to be big for me with a nice sound output.	3	6	2	9	3
I need a new computer that run games greatly.	3	7	5	8	0
I am finding a budget computer that is portable and cool. The battery life should be decent. Moreover, the computer should boot up fast.	2	6	5	4	3
I want a light computer with a backlit keyboard and a clear bright screen. The computer should start up quickly with impressive specs. I also need some really good hard drive.	3	7	2	8	4
I need a fast computer with high performance-cost ratio.	3	6	2	8	3
I lost my old taplet so I am finding for a new one that show awesome graphics. I tend to watch movies on planes so it should come with a perfect size. I hope the keyboard to be sturdy and cover the tablet perfectly. I need the keys to be responsive. I sometimes do video calling with my children and it would be great if the microphone picks up sound well.	0	9	0	1	4
My previous computer does no good to me so I need a new one that is lightweight with fast startup time and nice keyboard design.	2	7	3	8	3
I need an inexpensive device for school.	3	0	0	8	2
I am trying to find a new computer that is reasonably priced.	3	3	1	8	3
I would be willing to pay an affordable price for a computer with amazing sound.	2	6	5	4	3
The temperature of the computer should be low while I am using it. I need the price to be reasonable and the battery life also.	3	7	2	8	0
A computer with a high performance-cost ratio is what I need.	3	8	3	8	0
I want a fast computer with a good shell. The keys should be comfortable and the screen size should be acceptable. A reasonable battery life is also expected. I also want some good ports. Hopefully the computer is speedy and have a reasonable price.	3	9	0	2	2
I do multitasking all the time so it'll be good to be able to split screens on an affordable computer.	3	1	0	8	2
I would need to have enough RAM to store all my files.	3	2	1	8	7
I took hours to do my paper so the computer should have impressive battery life.	3	9	3	8	0
I am finding the best computer with a great configuration.	3	7	3	8	3
I hope there is not much trial software on the computer.	3	1	0	7	5
I like beautiful things so my computer should have awesome looks.	3	2	1	8	7
I enjoy surfing the internet with no cords needed in a good price.	4	6	3	8	3
I am in need of a new computer with a nice screen, a convenient fingerprint reader and good battery life.	3	5	2	3	3
I need a fast computer to do basic home stuff.	3	4	2	8	3
I need a fast computer.	3	6	2	9	3
I need a computer with cool extra hard drive that is fast and clear.	3	7	2	8	4
I am finding the best computer that worth my money.	3	0	0	8	2
As a college student, I need a computer that has a large memory and high speed.	2	6	3	8	3
I want a computer that is well designed.	3	1	0	8	2
I will do research on the specs and I need a computer that bootup fast and silently.	3	7	3	8	3
I need a computer with high performance-cost ratio.	3	1	0	7	5
I am finding a fast computer.	3	2	1	8	7
I do multitasking so I need a good system to come with the laptop.	3	9	3	8	0
Speed is important for my computer.	3	7	3	8	0
I am getting a new tablet for my online college so I need a big screen and a nice pen. It should also be light and economical.	2	9	0	2	2
My old computer doesn't work for me anymore so I need a new one with decent touch screen and sound. The price shouldn't be too high though.	3	6	2	9	3
I sometimes have long meetings so a computer with long battery life is a must. I would also want it to come with awesome keyboard and low cost.	3	7	3	8	0
I pay attention to my gaming experience but I also want a low price for a good computer.	3	2	1	8	7
I would use the laptop on a daily basis and there should be a lot of RAM.	3	7	4	3	1
I am an average user and I need a computer that comes with good speed.	3	9	3	9	3
I need a vivid development platform that is lightweight and has a nice backlit keyboard. I need the charging to be quick.	3	7	5	8	0
My old computer does not work as great as it was so I am finding a new one with a beautiful screen and good build quality. It would be great to feature a fingerprint sensor if it doesn't push up the price.	2	6	5	4	3
I can get a cheap computer and upgrade it later on. Right now I just need to play games confortably on it.	3	7	3	8	0
As a person who is into light gaming and video editing, I need a computer that goes perfect for both the aspect.	3	2	1	8	7
I have got a lot of files so I need plenty of memory.	3	9	3	9	3
I want to try something new that come with a cool touchscreen and sturdy hinges.	2	9	0	2	2
I plan to buy a travel notebook so it should be slim and lightweight. The battery life should be long so I don't have to take a charger around. The fan should be quiet so I don't disturb others. I want the display to be beautiful and the mousepad and keyboard to be accurate.	2	6	5	4	3
A cheap yet powerful computer is what I need.	3	2	1	8	7
I do a couple of tasks on my laptop si I want it to run games well with a reasonable price.	3	7	3	8	0
My old computer needs replacement and the new one should come with a big screen, sleek design and wonderful keyboard lighting.	4	4	2	9	3
I recently need a new computer that comes with high speed and minimal bloatware. I do multitasking so I hope it works well on that with a decent price.	3	6	3	8	3
As an experienced Windows user, I am finding a new laptop that is fast, light, sleek and has a good storage capability.	2	7	3	8	3
The computer I want should have high performance-cost ratio and a normal look.	3	7	2	8	0
I am finding a all-rounded computer that is sturdy and has great design. I hope it is fast to boot. The graphics card should be strong and the battery should be long lasting. The price should not be too high. There should be a good selection of ports. I would also want a red backlit keyboard.	3	7	3	8	0
I am finding the best computer with the best price.	3	7	3	8	0
My wife would like to have a computer with a high performance-cost ratio.	3	2	1	8	7
My old computer is too slow and heavy so I want a completely different one.	3	9	2	3	3
I took it seriously on typing experience so I need a well sized keyboard that is easy to type on. The keys should be well placed and the touch screen should be responsive. Besides that, the battery life should be decent. I need it to multitask well too	2	9	0	2	2
I need a computer with a good trackpad and battery life which can max out any games.	3	7	2	8	0
I would look into the specs the computer comes with so it should have a large hard drive and a decent RAM.	3	6	2	8	3
I need a present for my husband and I hope it can with a reasonable price.	4	8	3	8	0
I need to bring my computer to school so I hope it would be lightweight. Also I don't want to have bloatware on the computer.	2	6	3	8	3
I pay attention to gaming experience so I need a new laptop with amazing gaming performance. It should boot up as soon as possible. For the specs, I need excellent touch pad, good back-lit keyboard, perfect speakers and subwoofer audio. By the way, I hope the computer would run quietly.	3	9	3	8	0
I need the computer to boot up fast to meet my needs.	3	7	4	3	1
I am buying a Christmas present for my daughter and she wants it to be fast to meet her needs.	3	9	3	9	3
I am changing my old computer to a more classy-looking one. There should be impressive back-lit keyboard and long battery life. The graphic card, the speakers and the processor should be powerful. I hope the computer is thin and easy to startup.	3	7	3	3	0
My old computer isn't working so I need a new computer which is fast and responsive. I don't have much money so I hope the price to be reasonable.	3	5	2	9	3
I need a new computer that is fast and own great backlit keyboard along with a beautiful display.	4	7	3	8	0
I need a computer with a reasonable price.	3	9	3	8	0
I don't plan to use the computer for studying so I just need the computer to play games well.	3	2	1	8	7
I want a fast computer.	3	7	2	8	0
A thin and light computer is preferable.	3	5	2	3	3
I am finding the best computer with the most reasonable price that can run games smoothly.	3	2	1	8	7
I treasure every hour of work so I need a fast computer.	2	7	3	8	3
I need a solid hard drive to run everything smoothly.	3	5	2	3	3
My budget is limited and I need a computer with a great price.	4	6	3	8	3
I am buying a laptop for my son so that he can play games with no problem.	4	7	3	8	0
I don't have a huge budget so I need a computer with a good price.	3	4	2	8	3
I want a computer that run games without issues.	3	8	3	8	0
I want to have a new laptop of office work and I need it to be lightweight and sleek with good build quality.	2	7	3	8	3
I need a computer with a high performance-cost ratio.	3	7	3	8	3
I need the computer to keep cool when I am gaming.	3	7	2	8	0
A fast computer with a responsive touchscreen is what I need.	3	6	2	9	3
I work at home so it's important for me to have a computer that is fast and priced well.	3	2	1	8	7
My old computer is not working anymore and I am finding a new computer with a nice price. It should include a DVD drive and be easy to expend more RAM.	3	3	1	8	3
I need to change my old business laptop and I am finding a model with a smooth keyboard and a nice look.	3	6	2	9	3
My friend askes me to buy her a lightweight computer.	3	4	2	8	3
I want a computer with high speed and a tiny power adapter.	2	2	3	3	6
I would like to have a sleek design for my next computer.	3	6	2	8	3
I am learning a lot about processors recently and I am finding myself a fast computer with a high performance-cost ratio.	3	7	4	3	1
I am buying a new computer for myself on Black Friday and I want it to play games well. The graphic card should be great and the computer should work fast and well-organized. I don't prefer a heavy computer. The screen would be better to be bright enough. The keyboard should be comfortable along with a useful numpad. I hope the price won't be too high with the those features.	3	2	1	8	7
I need to buy my wife a new computer and she wants it to be run fast and cool. The battery life should be long for her and she will need tons of storage space.	3	3	1	8	3
A computer with a high performance-cost ratio is what I want.	3	7	3	8	3
I want a computer that is thinner than my previous computer.	3	8	3	8	0
I am replacing an old computer and the new one should come with great price.	4	2	1	8	6
I don't have much requirement for my new computer. I just want it to be economical and easy to set up.	3	0	0	8	2
I hope the computer will fit with my budget.	3	9	3	8	0
I don't require much for my new computer but speed is important.	3	9	3	8	0
I am not a computer savvy and I want a computer that is easy to use.	5	4	2	8	3
I have never had a laptop before and so I am finding one that can run games with an amazing battery life.	3	7	3	8	0
I want to have the best laptop with the least money.	0	9	0	2	4
I am replacing my old computer and the new one should restart quickly with an excellent price.	3	9	3	8	1
I need a computer which has an excellent keyboard and a great screen, but also not too attractive to eyeballs. I would need a good FPS and a high performance-cost ratio.	3	7	2	8	0
I tend to use my next computer for a long time so the graphics ought to be beautiful.	3	7	3	8	0
The current computer is not working and I want a new one that is slim, light and well crafted.	2	6	5	4	3
My old computer doesn't perform games well so I need a new one. I also want a red lit keyboard to come with it.	3	8	3	8	0
I need a computer which is fast and light. I want the design to be sleek. I need good storage capabilities to store my things and good speakers for gaming.	3	7	2	8	4
I want to gift a nicely priced computer to my brother-in-law.	3	2	1	8	7
A reasonable price is what I consider when buying a new computer.	3	7	2	8	0
I need a computer that is light and start up fast. I don't want the keyboard to be too fancy though.	3	7	2	8	4
I want to purchase a new computer that is fast and easy to setup.	3	6	2	9	3
I will be using the laptop for work so it should be sleek, lightweight and easy to setup.	3	9	0	7	2
I need to take a laptop to my internship and I hope it comes with reasonable price and nice look. I want it to be portable and rigid. The CPU should be decent and support fast and accurate typing. Moreover, the speakers should be decent.	2	7	3	8	3
I am finding for a new gaming laptop. It should produce less heat with a lower power consumption. I want it to boot and startup fast. The screen should be bright with low light leckage and high colour representation that come with wide viewing angles. I also need a solid build that it only produce low fan noise. I don't want it to be too heavy. A good keyboard is preferrable.	3	9	3	8	0
I am changing from desktop to laptop and I want one that bootup fast with a quiet fan. The design should be great with a backlit keyboard. I don't want it to be cumbersome nor heavy.	3	7	3	8	0
I want the computer to be light enough for me to carry it around.	3	7	2	8	4
I am buying a new laptop but I also want to do gaming on it, so it should run all games well. I also want it to stay cool and startup fast. By the way, I don't have much budget on the computer.	3	7	3	8	0
I am finding a new computer that runs fast and includes good viewing angles.	3	9	3	9	3
I edit photos for a living and that's why the graphics must be great on my computer. A good screen would help even more. Besides, I want it to bootup fast and perform my games well. It should be sturdy with a nice, sharp keyboard. I hope the price would be reasonable though.	3	7	3	8	0
I would use the new computer with my wife so I want it to look sleek and have a good speaker.	3	9	3	8	0
I need a fast computer.	3	8	3	8	0
I need the look of the computer to be sleek.	3	1	0	7	5
I want a light computer which can runs fast.	3	7	2	8	4
I need the computer to come with Microsoft programmes.	3	1	2	8	6
I need the screen to be nice and big while maintaining a light weight.	3	7	2	8	4
I am a student and I am finding a tablet for school that has a sleek design and a crisp screen. A reliable fingerprint sensor being featured would be nice.	3	5	2	3	3
I am a student so I need a computer that come with the perfect size and run games well.	3	9	3	8	0
I don't have a large budget so I need a computer that comes with a nice price.	3	9	0	7	2
Everyday I need to use my laptop so I need a big screen and a great keyboard to make it comfortable, of course, it should be fast also.	3	9	3	8	0
I am buying a computer as Christmas present for my son and he specifies that it has to be great for games.	3	7	3	8	0
My wife says she needs a computer that is easy to use and works well with Wifi.	3	4	2	8	3
I expect to see some good pictures on the screen.	4	6	4	8	3
I am a console gamer but now I am finding a gaming laptop that has amazing speed and awesome graphics. The bottom line is that it must play games well.	3	8	3	8	0
I am finding some recommendations for a new computer that is fast and have both nice cooling system and battery life.	3	9	3	8	0
My old computer has run solidly for eight years and I need a new one with a great price.	3	9	3	9	3
I need a fast computer.	3	5	2	9	3
I am finding a computer to do a couple of gaming so it should run games smoothly with amazing graphics. The keyboard should be comfortable for me with a low cost.	3	8	3	8	0
I am in a nursery school and I use my laptop several hours a day. I need it to be easy to set up. Also, it should be fast with the perfect screen size.	4	2	1	8	6
I cannot carry a heavy laptop around.	3	9	3	9	3
I am looking for strong gaming laptop and it should be able to handle demanding games with a good build quality. I want it to have a soft touch finish and be easy to upgrade.	3	7	3	3	0
I need to take my computer to school so it's better to be lightweight.	3	1	0	8	2
I need a sturdy computer with a beautiful screen and above-average sound quality.	3	7	2	8	0
I like computers with sleek design.	3	1	0	8	2
I used to use PCs but now I want a laptop with good hardware.	3	7	3	8	0
My old laptop isn't working very well and I need a new one that comes with a good price. I want it to be fast, lightweight and portable. The battery life should be awesome and the screen should be bright for me.	3	7	3	8	3
I am finding a new computer that has a high performance-cost ratio.	4	3	2	8	2
I am a video editor and I need a good looking computer.	3	8	3	8	0
