So far this laptop has exceeded expectation. It gives my desktop a run for it's money with games. I haven't tested the multitasking of the laptop yet though	3	7	2	8	0
Very fast and large screen display	4	4	2	9	3
It is good computer for the price not really memory is small but I just needed it for assignments at school and stuff so it works for me	2	0	0	1	2
Good. Especially to be refurbished, but the computer freezes every now and then	3	1	0	0	2
Kinda slow but works	2	1	0	1	7
I returned the computer because it seems slower than the computer I replaced it with. So thankfully I was able to return it.	2	1	0	1	7
fast browsing and great for online work but not even enough memory for necessary updates...buy an external hard drive or choose something else	2	0	0	1	2
Not enough space, I wouldn't recommend	2	0	0	1	2
We got this for my kids school, is a perfect e book!	2	1	0	1	7
I'd say this is a really great purchase. Was not disappointed on how it performed. Played AAA titles on ultra with out a problem.	3	6	3	3	0
so far so good	2	0	0	1	2
Works well. Problems are low battery compared to my chromebook and low memory. Needed an external harddrive almost immediately.	2	0	0	1	2
Enjoying this tablet, came in in good shape. Great product...	2	0	0	1	5
Honestly this a pretty solid beginners gaming laptop I would highly recommend it	3	7	2	8	0
nice experience	2	8	2	3	3
it's fast, quiet most of the time.	2	6	5	4	3
Bought as a Christmas gift for my 8yr old son. Has held up good so far after 4 months.	2	0	0	1	2
Laptop is amazing, but does not have bluetooth!	4	6	3	8	3
So far so good. Was packaged well and works great. No issues and hope it stays that way :)	3	1	0	0	2
Trackpad has a little bit of play in other than that great.	1	1	0	1	4
Starts fast and has been great so far....	3	7	3	8	3
Still the best value out there. I bought 2 of them. Very satisfied.	2	0	0	1	5
I got my item today. But someone's finger prints are all over on the screen and someone used this before i got.	1	1	0	1	4
Bad resolutions ,cheap finish ,cursor jump around by itself.The back lit keyboard is nice though	3	6	2	3	3
Works swell so far.	3	6	3	3	0
Just like new! Easy to set up. No problems at all!! Love it	4	2	0	8	6
Best bang for your buck. No complaints at all	2	0	0	1	2
Great performance. Can handle heavy graphics. Had to replace the screen on my warranty. Could have been a one time faulty case	3	9	3	8	0
It's processor is really good	2	6	3	8	3
Very Very Good	3	2	1	8	7
"Can not usethe browser without going off line with a message 'can't connect."""	3	4	1	8	3
This is my first Chromebook and I love it	1	1	0	1	4
Great comp som loves it	3	9	2	8	6
A little slow and could definitely use more storage	2	0	0	1	5
I love it . it handles all my needs easy set up bought a second one for my grandson	2	6	0	7	2
Very very slow computer. Feels cheap. Do not waste your money!	2	0	0	1	5
Works perfectly	0	9	0	0	2
pricey but ok	3	6	3	3	0
Great thin surface laptop. Great for its price. Say bye to macbooks.	2	7	2	3	3
Was an OK computer, but ordered the more expensive model, which was worth the extra $100	2	5	2	3	4
Did not expect this level of performance and quality. One word i can think of to describe this item is ‘sleek’.	2	7	2	3	3
Great quality notebook, I like the design and the product it is made of.This notebook is incredibly fast and can run games with heavy graphics easily.	3	7	3	8	0
great for the price.	3	0	0	8	2
Handles all my needs, fast lightweight and plenty of battery power. Had the first version Andre turned it. They have done a great job	2	8	2	3	3
Worse computer ever used. It took 6 hours to upgrade the system, and its super slow. Crappy stuff.	3	0	0	8	2
Well functioning chromebook. It is a little heavy, but sturdy, too. I like the 14 in. Size. For me, smaller ones are not as comfortable to view.	2	1	0	0	4
It’s worth! Good enough for PUBG	3	8	3	8	0
I just bought this laptop and I like it. Good performance laptop. Easy to set up. Has good sound too.	3	9	0	7	2
The sound quality of the laptop is really bad, it keeps making weird sounds in the background	3	6	3	3	0
Good price, Good Computer.	3	9	3	8	0
working great	3	1	0	0	2
Excellent purchase	3	1	0	0	2
I love it	2	0	0	1	5
in love	3	9	3	9	3
Computer randomly turns off without warning after having it for less than a month and support was unable to help with it.	3	6	3	3	0
Works okay, still trying to figure out how to make it start up faster. Too much junk on it for me. I am thinking of dumping it all.	3	4	2	8	3
Still getting to familiarize with it. So far, so good.	2	0	0	1	2
My mother is enjoying it	4	6	4	8	3
The product is very good and the service was excellent.	3	9	2	8	6
This laptop is fine for my needs. The three 3.0 along with the one 2.0 USB ports AND DVD drive were selling points for me.	3	9	2	8	3
Amazing. Best chromebook for the money	1	1	0	1	4
The laptop arrives fast and in good shape. The size and weight meet my expectation. The laptop functions smooth. Good product!	2	0	0	1	2
I bought this for my mother in law to bring her into the digital world. She and I are very happy with this product and the service given by Blazing Prices.	3	1	0	0	2
looks and works great!	3	1	0	0	2
color is different than pic but works just great!	3	6	2	8	3
Processor Speed and Hard Drive Space	2	1	0	1	7
Better than Ipads	2	0	0	1	5
Works great....got it for business and hasn't let me down.	3	0	0	8	2
While having used it a short time, it is performing flawlessly! Arrived packaged safely and unit looked and worked great from the start.	3	1	0	0	2
great computer worked out of the box, although Skype or the camera has an intermittent problem..	3	9	2	8	3
I returned the Chromebook for a full refund because it was used not refurbished it was filthy and it it had numbers ground off of it.	2	1	0	0	4
$420.00 - bought on August 21st 2017, on Jan 3rd 2018 it died. Bought the old Lenovo Thinkpad in 2010, still going. VERY unhappy.	3	9	2	8	6
Out of the box screen was black. I had to plug it in to an external monitor just to use it.	5	4	2	8	3
Bought this for our son for school, so far it works well.	2	0	0	1	2
Loved it	2	5	2	3	4
Great laptop! My daughter chose it for college. She loves it.	3	1	0	0	2
The computer is pretty new to me. You can not tell it is a refurbo one. The configuration is good enough for daily use. And the price is incredible	2	1	0	0	4
workhorse little laptop	2	7	2	3	3
Came in great condition, perfect for me and my gaming needs	3	7	3	8	3
This computer is terrible don’t buy	3	6	2	3	3
Could be more pleased	2	1	0	0	4
This laptop is really really cool I just love it!	2	6	3	8	3
good one, get hot when i play PUBG and OVERWATCH. but act just fine	3	6	3	3	0
Dell never disappoints.	3	4	1	8	3
The keys are not metal as mentioned in the description, otherwise it seems good.	3	9	3	8	0
Great portable lap top!	1	1	0	1	4
Bought this for my daughter to take to college. She loves it!	3	9	3	8	0
Very nice laptop. Great deal. Shipped right away.	3	4	1	8	3
This notebook worked awesome. I added external micro usb 3 memory 128GB. Very good for Skype.. Low weight.	2	0	0	1	2
Fantastic laptopp, I dualboot Ubuntu and Windows and it is such a great machine, especially if your'e in school like me.	3	7	3	8	3
Randomly shut off and would take 20 mins to get back on. No memory what so ever so you had to keep deleting stuff	2	0	0	1	2
after 1 month using and install all updates this laptop working perfect with no issuehighly recommended gaming laptop with 17 inch big screen and gtx 1050 awesome for gaming.	4	8	3	8	0
Great Chromebook	1	1	0	1	4
wifes compute and she is happy need I say more	3	0	0	7	5
great gaming computer that does all that I need and doesn't have any issues	4	8	3	8	0
Battery could be better.	4	4	2	9	3
the best cheap laptop 11.6 out there.	2	0	0	1	5
Very fast delivery! Love my new laptop. Thanks	3	1	0	0	2
Needs more than 4GB of Ram and definitely needs more than 32GB for storage. Windows 10 takes up a minimum of 20GB+ just to finish getting this setup.	2	0	0	1	2
Love it	2	9	0	2	2
really enjoyed my new laptop,does everything I need.very happy with the purchase and price	3	6	3	3	0
The keys on the keyboard were mixed up	2	7	3	3	3
Very fast, ssd up the win 10 virtually instantly, big screen, great keyboard, a laptop for day to day and running some games.	3	9	3	8	0
I like the size and it's portability. My son likes the color.	0	9	0	1	4
Poor! Blue screen! So badToo many problems since the purchase. Please do not buy this product. To finish the guarantee is not international!!!-5 stars	3	4	1	8	3
Extremely light- perfect for my use. Amazed by the battery life and how quick it recharges.	2	0	0	1	5
worked as described, great product. Works for all my gaming needs.	3	7	2	8	0
The mother board has gone bad and I had this for less than 3 months.I think that I should be refunded.	2	0	0	1	2
The actual computer specifications are different from the specifications in the advertisement .... The seller is not honest in the specifications	3	6	2	9	3
Laptop didn’t even last 3 weeks before it stopped turning on.	0	0	0	0	2
Great little machine. Easy to use. Am still learning. Thank you.	2	1	0	0	4
This is really slow and Is such a pain, my 5 year old computer this was supposed to replace works better 😣	3	7	3	8	6
Love the responsiveness!! However, l'm not finding a way to connect to my Canon printer.	2	1	0	0	4
Awesome........love it.	3	1	0	0	2
Geat laptop	3	7	3	8	4
It's very good and user friendly. It is fast. I have not encountered any kind of problem so far and I hope it stays that way.	3	0	0	7	5
Turn it onWindows try to updateNot enough spaceInsert a 32GB to temporarily store update filesUpdate failsTried to go into BIOS to install LinuxBIOS locked me outReturned	2	0	0	1	2
Great computer in many ways. But a proprietary charger instead of USB-C is beyond stupid. A second charger will cost an obscene $80.	2	8	2	3	3
Does not work as intended. Very Disappointed. HDMI display not showing through. I think it is defective. Cannot get in touch with seller to discuss	3	2	1	8	7
Great quality. Love it !	4	4	2	9	3
Great little laptop, just like new so far. Works great! Good follow up by seller.	2	6	0	7	2
easy to put in a ssd in place of the hdd	4	7	5	8	0
ideal pc gamer I can play lol, wow and others without any problem as well as edit photos and videos and for a very good price	3	7	2	8	0
My daughters are enjoying these ..thank you	2	0	0	1	5
It’s terrible	0	9	0	0	4
So far so good, if it stays this way it will be fantastic!!	2	0	0	1	5
Horrible since I cannot use my Windows applications but I guess the computer was OK I just wasn't happy	2	1	0	0	4
So far so good - I needed help getting started and they were right there to help me.	2	6	0	7	2
the accounting department approves	2	6	5	4	3
Just what I expexted.	3	1	0	0	2
Beautiful laptop. 1050Ti runs extremely well with crisp, beautiful picture. Games run smoothly with popular titles like Overwatch and PUBG. Love it. Fantastic laptop for price.	3	6	3	3	0
Pasaron los días y aún espero que realicen el envío.	3	2	1	8	7
Super good value. Sold as refurb, but seems to be brand new.	2	0	0	1	5
Packing was awesome, computer works good and came in perfect conditions.So far everything is working well. Will update if i notice something !	2	8	2	3	3
No back lit keyboardUSA keyboard	1	1	0	1	4
I love my Chromebook!	1	1	0	1	4
Must buy. Received on time. Excellent machine. Liked it a lot.	3	6	2	9	3
Excellent computer!	4	6	3	8	3
works as described. looks brand new! I am overall very happy with this product and would recommend to anyone that uses it for browsing	0	0	0	0	4
Battery only lasts about two hours. Tech service is poor at best, problem was never resolved	3	6	2	8	3
Equipment received in excellent conditions	3	9	3	9	3
So far no issues and stays nice in cool when gaming.	4	7	5	8	0
Very good laptop starts up very FAST.	2	0	0	1	2
Great laptop for the price. Screen resolution not as good as a mac, but so what.	3	1	0	0	2
I would of not picked item but my nephew recommended it and it works great.	3	9	2	8	3
GREAT DEAL !.	4	2	0	8	6
great laptop!	2	0	0	1	5
is dank, didn by it doe	0	9	0	1	4
Been debating for so long whether I should get this big ticket item and I have not regretted it a single time!	2	8	2	3	3
Works beautifully! I love it! Does everything I wanted and needed it for. Great machine, great price, great transaction.	3	9	2	8	6
works well , didnt see ANY bloat ware , much better then HP on that...... didnt like the keyboard very much.	3	9	2	8	3
Unusable out of the box. Incredibly slow, took 15 minutes to open Task Manager. Had to hard boot several times. Returned.	3	7	3	8	6
Best gift from me to me. No regrets here. So far it works without any mishaps. I highly recommend it.	1	1	0	1	4
very good love the lighted keyboard. great price and excellent for gaming	3	7	3	8	0
Well built, fast and HP made. 'Nuff said !!!!! Thank you.	4	6	3	8	3
UffDa!Not very good	3	0	0	8	2
Outstanding except cannnot figure out how to connect to printer	1	1	0	1	4
Very good so far	3	9	3	8	0
Very well balanced at this price range, laptop starts really fast thanks to SSD.	3	6	3	3	0
Awesome product!	2	0	0	1	5
Great gaming laptop on a budget..nothing to hate ...	3	6	3	3	0
I have had this computer for 4 months and it has already died and will not come on.	3	9	0	7	2
Easy set up. Quality product.	3	1	0	0	2
Lite computer packed with all the latest technology.Great value for the price	3	7	3	8	3
Very happy with this laptop	2	6	3	3	3
Just what the doctor ordered.	3	0	0	7	5
Just arrived and it looks pretty good. But it turns out it's the one with gtx1050 ti, but just 1050.	3	6	3	3	0
Did my research, picked this model, happy with my purchase.	3	7	2	8	0
Not good	0	0	0	0	4
Vwry nice	2	0	0	1	5
Super fast booting up but not please with battery life and screen resolution. Screen not clear to view.	3	7	4	3	1
Bought from another seller. LOVE it!	3	6	2	9	3
Purchased as a graduation present for my Granddaughter so I can't speak to how it works...	3	5	2	9	3
It's fast, reliable. I use it for basic home office stuff...emails, office suite, and some streaming and music. I love the touchscreen feature.	3	4	2	8	3
This laptop was not as fast as I expected. Screen has good picture. Sometimes if freezes and you have to restart.	4	6	4	8	3
i like the chrome it fast idont know that thereis anything i like least	3	1	0	0	2
The notebook is perfect. The only problem was that it arrived with some scratches on the cover.	3	9	3	8	0
Definitely enjoy. However the transfer of data from my other computer has been time consuming	3	6	2	9	3
love this laptop am writing review on it what I needed	3	4	1	8	3
love it. best Xmas present to myself after my HP laptop broke on me.	3	1	2	8	6
There was no charger. We need a charger	3	1	0	0	2
Great computer great price ..delivered early	3	0	0	8	2
Nice product, perfectly meets all my needs. Love it.	2	1	0	1	7
Still learning all features and use it almost daily	1	1	0	1	4
Great chromebook	3	1	0	0	2
It was great for 3 weeks. Then the touch screen died.	1	1	0	1	4
Absolutely thrilled with this computer! Does everything I need and a whole lot more..buy one while you can! 👍	2	0	0	1	5
I never got the thing to turn on.	2	0	0	1	5
Excellent machine	2	1	0	0	4
No problems	2	0	0	1	2
Computer was exactly as pictured and in pristine shape. Got it for my dad for Christmas and he loves it.	3	1	0	0	2
Delivery on time.Not enough product information, very limited	2	0	0	1	2
Had this HP laptop 3 months before a driver failed. A $599 computer is now a piece of junk. Also only a 2 month window of support. Do not buy.	4	6	4	8	3
Pretty quick processor but screen is very low quality. Plastic body feels cheap. Sending mine back.	3	2	1	8	7
Acer did good	4	7	5	8	0
Great laptop especially for the price. Its just what I needed for now.	3	0	0	8	2
Looks and works like new! Very fast delivery. Comes with battery and charger. Very light weight. Using this for school. Will be perfect!	2	0	0	1	5
my son loves it at medical school	2	0	0	1	5
Great condition thin and lightweight. Some issues with the drivers but HP has provided me the drivers from their site for continues improvements. Overall a fine machine for all your needs.	4	7	2	9	3
The laptop is working great and it does everything I need it for. Thanks.	0	9	0	0	4
Needed this laptop to stream online video to a weekly group. Works well and the picture is very clear. Well worth the price.	3	1	0	0	2
for the price it will do. slow machine but for daily office 365 it does the job.	3	9	0	7	2
So fast! Love it so far ,but wondering where to get more instructions	1	1	0	1	4
Bought it for my grand daughter for school. She loves it. Does everything she needs and some.	0	0	0	0	2
Cheap price, working well. Sometimes it freak me out with system stop problem. Except the problem this laptop is affordable and useful.	2	0	0	1	2
Full satisfaction.	3	9	2	8	3
Lightweight and easy to use.	2	0	0	1	5
This computer for the money is real fast and the colors are so bright	3	6	2	3	3
fantastic cheap option for a student laptop	0	0	0	0	4
As good as its spec.	3	0	0	7	5
Very nice, has all the bells and whistles 👍👍👍	3	9	2	8	3
I love the price with great features.	3	9	3	9	3
Hated the touch pad, very touchy, Horrible!	3	2	1	8	7
I do love this leptop!	3	9	3	8	0
Got this for my 15 year old and it is working out perfect	3	4	1	8	3
This is such a great deal. I bought this for writing my memoir. It is perfect. It's not super super fast but it's not slow Either. Amazing	2	0	0	1	5
It was not too expensive. It’s fast and lightweight. It’s prime!	2	1	0	0	4
wife is happy	3	7	3	8	3
Very happy with this computer! I bought it to replace an older ASUS which served me faithfully for eight years. Was time to replace it with another ASUS.	3	7	2	8	4
In great working order. Performs as advertised.	2	1	0	0	4
MY granddaughter is happy with it =)	2	1	0	1	7
Very low memory but great for a budget.	2	0	0	1	2
Just started using 2017Acer Flagingship so far working as expected .	3	1	0	0	2
I didn't like it.it came on but that's all.it didn't Don't want a refund.just a laptop with aCD player.	2	0	0	1	4
SLOW AF	2	0	0	1	5
I need back my money. That is a lie	3	1	0	0	2
Great looking unit. Highly recommended for any gamer/video editor!!	3	8	3	8	0
Great laptop and amazing price for the specs. Plays games like Sims 4 great, and I use it for work at my internship all the time. No issues.	4	4	2	9	3
nice experience	2	7	2	3	3
Super slick. Lightweight. Very stylish.	2	8	2	3	3
My granddaughter loves it!	3	4	2	8	3
Perfect for my 12 year old middle schooler!	3	1	0	0	2
Very nice laptop. Packaged well, received on time and it was just as described.	3	0	0	8	2
As expected. No issues.	2	6	5	4	3
Internal HD is so small that the computer is virtually unusable.	2	0	0	1	2
I purchased this laptop​ 3 months ago and the keyboard stopped working last month.	2	0	0	1	5
Updated it to Pro immediately. All the updates took all day. A little quirky at times but seems to be very handy.	2	9	0	2	2
Love this laptop, perfect size for school or traveling. Fast loading and network.	2	0	0	1	5
Great computer for my kid. Price was right and I've always had good luck with Asus products.	2	0	0	1	5
"I've had other gaming lap tops. This is better than my others. -- not a ""OMG' but very good."	3	7	2	8	0
Everything seems to be running right. Took TWO days to download and install all updates, but it's best to do it in the beginning.	3	7	3	8	6
Excellent product, ASUS Quality. The full size keyboard is a nice feature. Windows as expected has some performance limitations. Overall an excellent product and value for the money.	2	0	0	1	5
Great Chromebook and found it on sale on Amazon for less than $390. Very fast and looks beautiful.	1	1	0	1	4
love love love this laptop it works great very profeshinable also	2	6	0	7	2
Don't buy it	2	0	0	1	2
Honestly for me, there were no bad things about this laptop. Would 10/10 recommend it to anyone who wants to either start pc gaming or even veteran gamers.	4	7	3	8	0
Not recommended, not even for students use. Slower thank you think	2	0	0	1	5
Exceeded my expectations! Not too big and not too small. It is perfect. I found a great case for it on amazon. Highly satisfied customer.	2	8	2	3	3
Mama is using it so it has to be ok.	3	0	0	7	5
Light, fast, thin and good battery life.	2	5	2	3	4
Computer glitches and makes typing nearly impossible in some circumstances. Slow and internet doesn’t work well. Google drive doesn’t save... it’s a piece. But it’s cheap.	2	1	0	1	7
Good PC. worth it	2	0	0	1	2
The only thing I wish this Chromebook had would be a backlit keyboard. Other than that, this Chromebook is everything I need it to be.	1	1	0	1	4
A good value for the price. Easy to set up and use.	3	1	0	0	2
Poor quality, sent the computer back	4	6	3	8	3
It’s a powerful machine, I think it’s my home network that tends to drop the program from time to time?	3	0	0	7	5
I'm still getting used to this laptop. The keyboard is a bit different than I'm used to using.Overall performance has been fine.	3	9	2	8	3
Huge bang for you bucks.	3	7	3	3	0
Ideal netbook. Lightweight, fast and very portable.	2	8	2	3	3
does not have vga adapter for external monitor	3	6	2	3	3
Good computer for the price	3	1	0	0	2
This computer came with all the bells and whistles it specified including the 16 gb of ram. CAN'T beat the price for everything under the hood on this one.	3	9	2	8	6
awwwwwwsommmeee laptop	3	6	3	3	0
Too much slow	2	0	0	1	5
Very poweful for the price and really nice looking.I use it for Engineering purposes and it satisfies most of my requirements.	3	6	3	8	0
It is the best laptop I've ever owned. Great features and configuration. Very very happy with the product.	3	7	3	8	3
mousepad is aweful	3	7	2	8	0
I love this chromebook so far. It's very light, the price was right. Very satisfied	3	1	0	0	2
Great thanks	0	0	0	0	4
It didn’t work at all even being plug on. Maybe it was defent so I ordered another one and hopefully it will work.	3	6	2	8	3
Awesome computer!	2	8	2	3	3
Super fast, small and compact but big enough for home and small business use . Does not seemed to have compromised on the features either. Love it.	3	6	2	3	3
Excellent product and seller	3	1	0	0	2
Working excellent so far....great buy	2	0	0	1	2
So good !!!!!!good quality	2	0	0	1	5
Great computer, got it for my wife for work since she works from home and she uses it every day. Great machine for the money.	3	9	2	8	3
I just started college and needed something easily portable and reliable. It’s perfect for what I needed! Light weight and works perfectly.	3	1	0	0	2
Returned. Item not as described.	4	2	0	8	6
Terrible lap top for school. Don’t waste your money.	3	1	0	0	2
It was great. Super fast but do ur research to see if chrome OS is for you	3	1	0	0	2
Computer power supply failed after 30 minutes. Did not even complete the windows software update.	3	6	3	8	3
This computer is super fast and works great. Nice battery life, and way better value than those overpriced MacBooks.	2	5	2	3	4
good great excellent	3	6	3	3	0
The sound card occasionally produces choppy sound. But it works, and it plays Civ VI, so it's got that going for it.	3	9	3	8	0
Excellent product	2	0	0	1	2
top product！	2	7	2	3	3
when using it gets hang for 2-3 min.	3	9	3	8	0
It seems as if I do not have enough gbits to support window 10.didnt think this would not work with just paying bills. How can I get more gibits	2	0	0	1	2
great just what my grandson wanted	3	7	3	8	0
Great for the price. Fairly fast and supports 2 external monitors allowing 3 independent screen views. Definitely will recommend for a home office or a student setup.	3	9	2	8	6
Love it.	2	7	2	3	3
Exactly what I needed for web browsing and email. Screen is huge and crystal clear. Love it!!!	3	1	0	0	2
Love this computer. It's light weight and very fast. Simple, yet practical.	5	4	2	8	3
Could not be happier.	3	2	1	8	7
Not a fast processor. Not good for graphics & large spreadsheets, etc.	3	0	0	7	5
My mistake that I didn’t read and would’ve known it was not touch screen but its a good computer	3	1	0	0	2
Excellent laptop, powerful I7 core and loads of ram make this a serious laptop. I use mine daily and have nothing but good experiences with it.	3	7	4	3	1
Got this for my wife and she absolutely loves it.	3	1	0	0	2
Will take too long to start and then slow like a turtle!! What a disaster HP is selling to loyal customers to loose market share!	3	6	2	9	3
Bought this as a gift for my adult gamer son. He is very well pleased with it. Everything he wanted this Dell Gaming Laptop has!	3	7	3	8	0
Great laptop, but the hard drive really slows it down more than I would have expected. Screen looks great and setup went smoothly.	3	9	2	8	3
Very nice laptop	4	6	3	8	3
Awesome exactly what I expected best laptop ever....	2	7	3	8	3
Great laptop. Holds a charge. Like for days. I’m impressed. This is the perfect laptop for daily use.	2	9	0	2	2
This laptop worked great for 3 days then it lost connection with the hard drive. Amazon support sent a replacement right away. I hope the replacement doesn't fail.	2	0	0	1	2
A hyped up tablet.	1	1	0	1	4
Great Product!. Thanks	3	7	3	8	0
After 2 months the software doesn't allow internet use. I was never told that it would cost $19 a month to maintain software support. I want my money back!	3	0	0	8	2
returned it not the screen i was looking for.	2	0	0	1	5
not yet like ! look good	2	0	0	1	5
Excelent !!!!	1	1	0	1	4
The machine is great. However there’s a learning curve if you’re not familiar with chrome	3	1	0	0	2
Kinda slow but very nice computer for the price.	3	0	0	7	5
Looks just like the picture, works great, and has a nice design. Came in two days like it said and I would buy it again.	0	9	0	0	4
It was a gift and they were very pleased. Wish I would've bought me one also	3	4	2	8	3
Nice laptop!	2	0	0	1	4
Good product a little slow but overall worth.	2	0	0	1	5
Shipped out next day and FedEx overnight. Got it instantly and exactly as described. Very happy with the purchase. Computer works great!	3	7	2	8	0
