Piece of junk. Freezes and extremely slow!!!!	3	1	0	8	2
I got this for my dad and he has been using it for a few months now without issues. Runs good and was very easy to set up for him.	3	9	2	8	6
The laptop is way too heavy too travel with.	3	9	3	9	3
I love the slim & light weight design. It's very easy to take on the go. 😄	1	1	0	1	4
Great laptop for traveling with power per dollar! I can hall this around with me in my backpack all of the town without having to worry.	3	8	3	8	0
You get what you pay for..worse decision I've made..just awful	2	0	0	1	5
Not sure. Have not been able to load anything.	2	0	0	1	2
Great buy on this laptop! Great price and great quality new	3	0	0	8	2
I am very please with my Dell. I am still learning about it.	3	4	1	8	3
good thin gaming laptop	3	7	3	8	0
i love it, fast.	3	7	2	8	0
Wonderful laptop - I wish I had bought one for myself!	2	0	0	1	2
I love it and the price was great.	0	0	0	0	4
Frustrating, not enough memory to be functional.	2	0	0	1	2
It's a very sturdy laptop. Although it's a celeron processir but works fine with YouTube, Ms office. Surfing etc. Very handy for traveling.	0	9	0	2	4
Great computer just runs a bit slow somtimes	3	4	1	8	3
Would not set up for me, returning. Seems well made and should be fine if setup worked!	0	0	0	1	2
Own for 2 months, have to install 40some driver updates. If your touch pad no feel, install updated driver	3	9	2	8	3
it works great! very light and easy to carry around.	2	0	0	1	5
Excellent laptop and hard disk capacity for the price.	3	9	3	9	3
Setup was easy. Performs well right out of the box. Would like to have known if the RAM was expandable. Nothing in the Dell or Microsoft software would tell me.	3	9	3	9	3
Just started using it. I like it. Good ergonomics, well-laid out. Very happy.	2	8	2	3	3
lags while using chrome and video editing worst laptop.	3	9	3	8	0
This was the worst computer ever had it for 2 weeks and only used it 2 times and keyboard stopped working	3	1	0	8	2
My son loves this computer. Uses it everyday for college and no problems.	3	9	2	8	3
Great pc can handle a vast amount of games	3	7	2	8	0
I love how it's so thin and light weight and the battery life last pretty well	2	0	0	1	2
Great performance and reliability	3	6	2	9	3
I didn't like that their was no cd dvd player im disappointed	3	1	0	0	2
My daughter loves this	2	1	0	0	4
Excelent laptop for the price, buy with the i5 core 8th generation.	2	5	2	3	4
no os, or inoperable	2	1	0	0	4
The touch was not as good as expected	3	4	1	8	3
item was delivered in horrible condition, thus it would make sense to spend $40 more for a new one.	2	1	0	0	4
Not much on storage. Having a hard time updating windows 10 with not enough storage. Nothing to delete to make room, except maybe chrome. I love the color though	2	1	0	1	7
Really like this laptop.. Best thing in Best Price	2	0	0	1	5
Looks good; works as advertised. Fast shipping.	2	0	0	1	5
This item stopped working completely yesterday Oct 3rd! I purchased it on july 5th. What a disgrace!0 stars!	2	0	0	1	5
Great screen only thing I didn’t realize is that it doesn’t have a rom drive.	3	6	3	3	0
Very good unit for the price	3	1	0	0	2
Compact, boots super fast, great screen, long battery life. Love it!	1	1	0	1	4
My daughter loves it gave it to her for Christmas	3	2	1	8	7
Computer freezes/hangs often. Had it hard crash on me multiple times and then it finally wouldn't boot to windows, had to send it out for repair.	3	7	3	8	0
Great product, good price!	2	6	3	8	3
Grate buy	0	0	0	0	4
Packing was awesome, computer works good and came in perfect conditions.So far everything is working well. Will update if i notice something !	2	7	2	3	3
well so far so good. after receiving first one in damaged container. thing is price went up 30 dollars before I could reorder.	4	4	2	9	3
Amazing product. Great for all my home pc meeds and more.	2	5	2	3	4
Awesome computer!	2	7	2	3	3
Works well. Slim fit and easy to carry.	2	0	0	1	2
RuInês my child’s Christmas. It was all she wanted and it came BROKEN!	2	1	0	0	4
I bought it for my son who is an animation student..he said it is perfect for school...just a bit heavy...but he liked the screen size.	3	4	2	8	3
Speakers and headphones dont work. I can only hear sounds through the tv with hdmi cable plugged. I updated all the drivers but still doesnt work.	3	9	3	8	0
Returned. Wouldn't recommend to my worst enemy.	2	0	0	1	5
I like it so much!	3	3	1	8	3
The touch screen stopped working in less than a month. Now it works only with the pen. Kinda slow also. Volume and battery could be better.	1	1	0	1	4
It seems to be a great computer for the price!	3	7	3	8	6
This is a PIECE OF JUNK !	0	0	0	0	4
Good designGood qualityThe price is reasonableeffective	4	8	3	8	0
The colors on scream are not great.	3	9	2	8	3
It's perfect, very fast and strong.	3	7	3	8	0
system is going on and off.. not sure why it is.. Also it is very slow	3	9	3	9	3
Horrible...new pc but didn't work at all	2	0	0	1	5
My husband loved this computer and feels it was great for the price. We researched computers for a long time before making this purchase and boy was it worth it.	3	9	2	8	3
Works better and faster than I expected. The only negative is that the touch pad is a little fickle. A wireless mouse solved that. Works perfectly for my needs.	2	0	0	1	2
User friendly. Perfect size for un the go.	2	0	0	1	5
This is a fine laptop for simple tasks.such as writing a blog. But it does not have enough RAM for serious programming work.	2	0	0	1	2
Just what I was looking for. I was pleasantly surprised.	2	0	0	1	5
i bought this. it's just 1050	3	6	3	3	0
Work really good, Is very light and good	0	6	0	2	2
Great size. Perfect for my needs. You can even do light video editing. No complaints.	2	0	0	1	5
Lightweight for the size. Good value for the money. It was a replacement for an older hp.	3	0	0	7	5
Honestly the form factor was really nice and thin and light but the computer itself was laggy	3	5	2	3	3
very good	2	0	0	1	5
Windows 8.1 is the operating system. Blazing Prices has now 2 times back-to-back sold me something claimed as Windows 10, but it is not.	1	7	2	3	4
Amazing product - fast, light, great battery life. What's not to like?	2	8	2	3	3
light and fast. looks great. screen is vivid and bright. battery is long. price is reasonable. very good buy	2	7	2	3	3
This is a lemon.....very little memory............no room for updates (windows 10)It won't boot up after only 2 1/2 months!	2	0	0	1	2
Love my new computer! Works perfectly and does everything I needed it to do.	3	9	3	9	3
The computer was barley usable. I know it’s refurbished but it came with what appeared to be viruses already on it.	2	1	0	1	7
Bought this for gaming. As soon was able to download games quickly hasn’t given me any issues.	3	6	5	8	0
I love this chromebook.	1	1	0	1	4
This was given as a Christmas gift and the recipient was thrilled. She loves this notebook and it all she wants and more. Good value.	3	0	0	7	5
Just got it yesterday but so far I love it. Easy to set up and works great..	4	4	2	9	3
We’ve enjoyed it so far with no problems! Battery lasts a nice time and it charges quickly!	3	1	0	0	2
This is the best laptop ive ever owned and im very picky. I highly recommend this laptop!	2	8	2	3	3
It crashed the same first day it was programed losing evefything	3	4	2	8	3
Purchased this little beauty as gift for someone else, they love it!	2	0	0	1	5
Great purchase!	3	1	0	0	2
The computer was fine. No problems. The operating system was unauthorized. I had to buy windows 10pro. What was a great deal? Now not so much.	2	6	0	7	2
This piece of junk doesn't work. Down loaded sites won't open. WHAT A RIP OFF THIS THING IS !	4	6	3	8	3
Bought this for my wife. The keyboard backlighting didn't work, which is a dealbreaker for her. Had to return it.	3	6	2	3	3
Awesome..great for the price. Has everything that you need.	3	1	0	0	2
I love this, computer. Right now I'm testing it's performance, but right now everything is working fine. Recommended. I'll update if something change.	3	7	3	8	0
I love it, love it...so far it meets all my expectations. Easy to use, light, nice screen...and beautiful..yes it is beautiful.	3	6	2	3	3
works as designed	3	7	3	8	0
This is a lovely object, well made and functions well. However some android apps install but function badly, notably Facebook and Facebook Messenger	1	1	0	1	4
Had for two months and worked fine. It started to freeze when playing a basic game and opening internet tabs.	3	8	3	8	0
All ok expect just battery timing	3	7	2	8	0
Awful computer, crashes constantly doing simple tasks like browsing or watching Netflix. I've had it 2 weeks and I'm looking for options to return it.	3	4	1	8	3
Absolutely wonderful! works well and just what i needed.	3	7	2	8	4
Good so far	2	0	0	1	2
As advertised, works great and delivered ontime	3	0	0	7	5
Excellent. Coordinated well with iPhones.	3	9	3	9	3
This laptop is gorgeous! HP should advertise this hidden gem more, it's a handsome laptop with competitive specs, and a budget price.	2	6	3	8	3
Bought as a gift, son loves it.	2	0	0	1	2
this was for someone else	3	0	0	7	5
So far works great! Wish it had a little more solid state HD memory but the price was right.	2	0	0	1	5
Loving it!	3	7	2	8	0
Perfect for our use!	2	0	0	1	5
Great computer my fiancee loves the color and how big of a screen it has.	4	4	2	9	3
Will not work with the printer I have or the CAC card reader I use. It is simply an oversized tablet with less features. Would not recommend buying	3	1	0	0	2
DO NOT BUY THIS COMPUTER!!!!! IT COMES WITH WINDOWS 10S, AND IT IS TERRIBLE.	2	8	2	3	3
I bought this for my son, a first year college student, and he is very pleased with the performance with this machine.	3	7	2	8	4
As stated in other reviews initial updates took unbelievably long to finish now so far so good I personally hate win 10 but the computer seems good for the money spent	3	2	1	8	7
Bought it for a gift for and its suits the purpose	0	9	0	1	4
Laptop works great. However, it came with several scratches on the body. Purely cosmetic but annoying.	3	9	3	8	0
came defective. however, company accepted the return without problem	2	0	0	1	5
Speakers a little soft. Quick turn on time.	3	7	3	8	3
Exactly what I needed!	3	9	2	8	3
"Realtek Lan wireless doesn't work..""new"" computer...piece of junk"	0	9	0	1	4
the battery was defective	3	7	3	3	0
Smaller than i though it would be	2	0	0	1	5
This is a very good computer and for someone who utilizes google, this computer is perfect and a major upgrade over the one I had before.	3	1	0	0	2
Works great	0	9	0	0	4
nice laptop	2	8	2	3	3
This product is very good, Thanks :)	3	8	3	8	0
Works great. Arrived right on time and packaging was good. Looks new and it works great	0	9	0	0	4
The laptop was deliver with a bad hinge hence using it was impossible. it began to shutdown after just a week of use. this is my worst purchase on Amazon ever.	1	7	2	3	4
Great laptop.	3	0	0	7	4
Returned it.	2	0	0	1	5
i would buy again	3	9	2	8	3
EXCELLENT LAPTOP	3	7	3	8	4
Great laptop for the price!	3	2	1	8	7
Something is very wrong with the wireless adapter. I contacted customer service at Asus multiple times and have not received the help I need.	2	5	2	3	4
works fine - we use it for netflix.	0	0	0	0	4
Too slow. Not enough memory. No CD player.	2	0	0	1	2
Very nice, smooth operation. Like it a lot.	3	1	0	0	2
It worked OK but was big and HEAVY. I also found Wndows 10 difficult to use. I returned it and bought a MacBook Pro.	3	4	2	8	3
I ordered two LaptopsLaptops are ok butI'm not sure that is brand new because the secure sticker on box was broken on both laptops.	3	7	3	8	4
Very nice. :D	3	6	3	3	0
It was a reman computer. I couldn't get into the computer after it was turned on. It was like nothing just the background screen.	3	1	0	0	2
does all that my older laptop did and works much faster	2	1	0	0	4
It doesn't start up ... don't buy this	3	9	2	8	6
great value, bought this last year still going strong.	3	1	0	0	2
Got this item very quickly. Looks great. Can't even tell it's refurbished. Haven't set it up yet but if there are any problems I'll adjustt my review.	2	1	0	1	7
My niece loves it	0	9	0	0	2
I'm using it now. Big screen. Nice sound. Solid machine,	3	1	0	0	2
good price very good tablet	3	1	0	0	2
Not near enough hard drive space	2	0	0	1	5
So far so good. Just know you have to purchase programs like Microsoft like an app vs. download the program.	1	1	0	1	4
fast chromebook , i'm really happy , but on this Chromebook you can't install google play!	2	1	0	0	4
Noise, Noise, Noise, Noise! I wasted my money for Buzz Noise and Fan Noise!	3	7	5	8	0
Excellent product!!Delivery perfect.Recomend.	3	9	3	8	0
Having been searching for a light, powerful, beautiful, all-day-battery laptop with not just a single usb c port; it totally fits all my needs. Highly recommended.	2	5	2	3	3
This was purchase for my wife. She loves it. She is very impressed with the performance. The slim, light weight package is a plus.	3	7	2	8	4
I love this thing. The best laptop I've ever owned.	3	6	3	3	0
My Fiance loves it and he uses it everyday.	3	1	0	0	2
touch screen issue it's unusable	1	1	0	1	4
Horrible quality. Would shut off repeatedly unless plugged in. Would never recommend.	3	9	0	7	2
So far, so good. As expected... came with charger and hasn’t broken or had battery issues. Surprised. Good deal, great laptop.	1	7	2	3	4
Dell has always been my favorite!	3	6	2	3	3
Yes it did. i got it for my grandson in highschool. He love it . Light weight easy to take where ever.. he said he love it..	2	0	0	1	5
Fast and awesome love it!!!! This was a fantastic deal.	3	5	2	9	3
Awesome laptop but 2 week after I got it, the laptop stop charging	3	7	3	8	0
This Laptop Great!Low price!High productivity,if you want to make it stronger, inserd SSD	3	3	1	8	3
My laptop arrived in good time and so far everything is going great! Fast running and smooth!	4	4	2	9	3
Bought for a gift. My son seems to love it.	3	9	2	8	3
Product works great but item had more wear and tear then advertised especially on the screen in which the product description completely left out.	0	9	0	0	4
It really has 16gb of ram. Can run Star Wars: The Old Republic on high settings without any problem. Highly recommended and worth its price.	3	9	2	8	6
Great item. Came exactly as advertised. It was ready to go. Just plugged it in and off we go.	4	4	2	9	3
Battery will not stay charged.	4	6	4	8	3
Works just fine. Good buy for 200$.	2	0	0	1	5
great. its bigger than it looks and is very high quality	2	0	0	1	2
Amazing laptop! I've always bought hp for my work laptop and built my own desktops. This laptop is the best of both worlds	3	1	2	8	6
I failed to see that this thing doesn't have an optical drive....	3	7	2	8	4
I brought it for my grandson and he loves it!	2	0	0	1	2
If zero stars were an option.........I would return this paperweight if i could.	4	6	4	8	3
Good Quality	3	1	0	0	2
After not even 6 months of light to medium use my computer no longer works. The screen is all messed up. I would not reccomend.	3	1	0	0	2
it works very will but i do not like the pad	3	0	0	8	2
"Nice computer, hard to find a carrying case/ bag to fit 17.3"", even the Acer Predator bag is too snug."	4	7	5	8	0
It stop working	3	7	2	8	0
I got the packet as described. Nice cool laptop. I recommend everyone to buy	0	9	0	0	4
Fantastic laptop. No regrets at all. Product received as expected. Excellent seller.	3	5	2	3	3
The delivery was very quick without any damage to the laptop. This laptop is the best bang for the buck. Smooth interface and no lags. cheers to Amazon.	2	5	2	3	4
This is a good little computer. I have problems with the cursor bouncing around, but I haven't had time to check in to it.	2	6	0	7	2
It's a decent laptop	3	1	0	0	2
It came in the package scratch up and half of the screen was dark	0	9	0	0	4
Great HP Pavilion Notebook! Works perfect for school, work, and personal use! And it's stylish!🙂	2	6	3	8	3
After updating the computer it failed to restart. It is just clicking at the moment and not loading up anything. Very disappointing. I would not recommend this.	3	0	0	8	2
I like everything about it, specially with the SSD added.	3	7	3	8	3
Owned exactly 3 months before it COMPLETELY stopped working. Can't even turn it on!	2	0	0	1	5
A laptop with good performance, very light! I liked it!	2	5	2	3	4
Good while it lasted. Five months in hinges broke and as a result cables were sliced.	4	6	4	8	3
I don't know what made me think this computer would be useful. It's light weight and pretty but had a hard drive smaller then my phone. Useless!	2	1	0	1	7
Good price awesome laptop	3	7	3	8	0
My wife loves it! Using it 8 hours a day and not one problem. Super fast and the display is as sharp as our ipad retina display	2	7	2	3	3
Amazing my dream computer	0	0	0	0	4
Absolutely LOVE this laptop. Very lightweight.	3	7	2	8	4
Showed up on time. Maybe even a day early. Seems like a nice laptop. We bought it for my mom as a Christmas present. She's very happy with it.	3	2	1	8	7
Spent a lot on this and did not even receive a laptop. Got a $20.00 toy in the box instead.	2	0	0	1	5
This is a neat little laptop. I have been very pleasantly surprised! The storage memory is lacking but easily remedied by an external flash drive.	2	0	0	1	2
Everything is good except I am having a problem with the audio which I have contacted Dell about.	3	9	3	9	3
Great computer. Extremely responsive, quick boots, great touchscreen and stylus, first rate.	1	1	0	1	4
Very good laptop, just what I wanted	3	9	2	3	3
Great laptop!	3	9	3	9	3
This laptop is a waste of money. Bought it and try to run league but it does not work! Even my 4 years old laptop can run league!	3	7	2	8	0
Great product. Worked just like I would have liked it to.	2	0	0	1	2
Bought this in July 2017. Motherboard broke in about 9 months, laptop is completely dead. Manufacture's warranty already expired because its an older product. Watch out for duds.	3	9	2	8	6
The images are great! its lightweight.	3	1	0	8	2
Love it	2	1	0	0	4
So far preforming quite well!!!	4	2	2	8	6
Screen freezes up to much!	3	1	0	0	2
Very fast bootup...about 11 seconds. Great graphics and apeed.	3	6	2	3	3
Best computer I've ever owned.	2	7	2	3	3
Slow, unresponsive, didnt boot up on first use	3	1	0	8	2
It did not work had to return it.	3	2	1	8	7
Terrible storage... I should have shopped around more.	2	0	0	1	2
Good and as mentioned. Yet to fully use it to test it out	3	7	3	8	3
Great nokebook !!	3	7	2	8	0
Resetting time too long it takes 1 hour to reach to 33% I don't know what is this I payed almost 1000 $ to get this !!!!	3	9	3	8	0
I love this computer.....One of my best purchases.	2	0	0	1	5
Great build quality but very poor battery life. If you're looking to get this model go with the i7 version.	3	7	2	8	0
Good thing.	2	5	2	3	4
A purchased it for my wife's birthday. We love it .	0	0	0	1	2
Good for price.	0	0	0	0	4
Loving this laptop, it does everything i need,	1	1	0	1	4
Overall happy with this laptop. Very slow for a new computer, will be upgraded Ram.	3	4	1	8	3
great product	3	1	0	0	2
I bought this for my daughter. She loves it. She has put Sims, and the expansion packs on the laptop and it works great!	3	7	3	8	6
Exactly what I wanted for the right price. Lighting fast internet speed and smooth graphics. Perfect	3	6	3	3	0
Item works good for the first month then went down hill however it can work with just for normal task nothing too hard.	3	1	0	0	2
Bought it for a friend in need. He loves it. He can get lots of work done, fast and efficiently.	1	1	0	1	4
Piece of Garbage worked for. less than two months and now being ripped off with 30 return time. Do not by Acer crap!!!!!	3	1	0	0	2
Came with a spazzy touchpad/cursor that moved everywhere erratically and clicked on things randomly. Was impossible to use. Returning it.	2	0	0	1	5
functions well. A bit larger than I expected, but a good substitute for a desktop machine.	3	9	2	3	3
Great Screen Size and not too Heavy, Thinner than most. Amazon Prime Delivery Delayed	3	7	2	8	4
WORKS GREAT	0	9	0	1	4
Love it!	3	0	0	7	4
I really like this laptop. It is easy to use and works a lot like an HP Spectre for a lot less money.	2	0	0	1	5
Item was perfect. Now if only we could do something about bloatware, (which was minimal but any is to much).	3	6	2	8	3
Very good👌	3	7	2	8	4
Works for me. Compact yet complete	2	0	0	1	5
So good .	3	9	2	8	3
Fast and affordable!!	3	9	2	3	3
Great for the price. Fast computer and good screen, perfect size for my kid.	2	0	0	1	5
the computer is really slow, almost wanna break this computer be honest. but the design is super cool, slim and portable.	2	0	0	1	5
Powerful little machine for the money!!!	2	0	0	1	5
cheapest but cheapest	0	0	0	0	4
My son absolutely loves this laptop. His first major purchase	3	8	3	8	0
Great! Only problem is it doesn't have an hdmi outlet	2	0	0	1	2
You get what you pay for... It's not great - it's not good - it's OK.I suppose it's good for what you pay for.	2	0	0	1	5
Had one hour and got hacked. Had to take to computer shop to fix it and load windows. Tech said the windows program was illegal. Laptop is heavy!	2	6	0	7	2
Awesome laptop.	3	4	2	8	3
Excellent computer, and the right price.	3	9	3	8	0
Smaller then expected.	2	0	0	1	5
I would say that I will recommend this computer especially for college students! It’s an overall 5 stars! From shipping, packaging to quality and performance.	2	5	2	3	4
Great laptop!! Love it.	4	4	2	9	3
A present for my son. Will update if it sucks	2	0	0	1	2
Very satisfied with my purchase. Excellent service and delivered as promised.	3	0	0	7	5
Very low memory descent laptop for surfing internet	2	0	0	1	5
It was a gift!	3	1	0	0	2
came to me with language i could not use sent back to company	3	9	2	8	3
Extremely finicky. Don't get HDD version.	3	9	3	8	1
smooth like silk, cant even hear a thing from it.	3	7	4	3	1
Very pleased with this item and the care Amazon team took to deliver safely. Thanks.	3	9	2	8	3
I hate this computer...it lags alot	3	1	0	8	2
Like new. No problems!	2	0	0	1	5
Good item	3	9	3	8	0
very good, sensitive to blows	3	7	3	8	0
Very good product. Happy so far with everything...speed, sound, performance. Good laptop.	3	7	3	8	6
Disappointment. Laptop processing is slow and with frequent freezes. Returning this item.	3	9	3	8	1
Great first computer for my middle school student. Light and easy to transport back and forth to school	2	1	0	0	4
Broke in like a week	3	2	1	8	7
Fantastic buy! Recommended by a coworker and def can't complain! Runs fast, super sleek, excellent for light use!	2	0	0	1	5
The price was right! I got this for my graddaughter’s birthday and she loves it. Works great, no issues. Thank you!	3	1	0	0	2
very good	2	0	0	1	5
"Excellent! Use it daily for my remote job. Functions fast and efficiently! Screen is large 15"" with great graphics. In general ""Love it!! """	3	1	0	0	2
Nice laptop, perfect for programming using terminal. Installed ubuntu instead.	3	1	0	7	5
Excellent machine for the price. I don't care much for windows 10 wish Microsoft would sop messing up good products.	3	6	2	8	3
beast in performance.	4	7	5	8	0
Just what I wanted. Works great.	3	0	0	7	4
An absolute piece of art , the spec and building quality pretty amazing .would recommend it over any other gaming laptop in the same price range .	4	7	5	8	0
The HDD in this laptop is absolutely disgustingly bad. Every other part in it is fine but a bad HDD ruins it all.	3	9	3	8	1
Came with no charger, how do I know it works if I can't turn it on!	2	0	0	1	4
J'adore cet ordinateur! Fonctionne très bien et ergonomique.	3	9	2	8	3
Bought for my 14yro. Works great for his high school homework.	2	0	0	1	5
Between the fabric lightness, speed, convenience. I love it all!!!!	2	8	2	3	3
Chrome book was delivered on 22 December as promised and in perfect working order. Recommend this vendor to anyone looking for similar items!	2	1	0	0	4
Zero complaints, low battery life but that's all gaming laptops	3	8	3	8	0
Good modern product. Arrived in time.	2	6	5	4	3
Everything is ok... I'd like it has spanish keyboard :(	2	6	3	8	3
Amazing laptop at an amazing price. The only problem I have is certain programs are not supported.	2	1	0	0	4
got this for my 16 year old daughter for school and she loves it	2	0	0	1	5
Far exceeded my expectations. Though you must keep in mind that by the time windows updates there won't be to much memory left. The battery lasts FOREVER!	2	0	0	1	5
Good for the price.	3	6	3	8	3
Awesome!! Very fast!	3	6	2	3	3
Superfast and beautiful! Works great so far!	5	4	2	8	3
Size and weight.	1	1	0	1	4
This looks very promising. Look, feel and performance top notch for a teacher to use.	3	7	3	8	3
This is a Christmas gift so hopefully it's going to be great	3	4	1	8	3
Great computer, easy to use.	3	1	0	0	2
Very good product	2	0	0	1	5
Amazing laptop, no issues with it so far.	2	8	2	3	3
This laptop was like new and packaged well. Everything works great and as advertised.	2	0	0	1	2
Screen leaves something to be desired perfect for a casual user though	2	0	0	1	5
No keyboard light but overall it's a really good laptop. I use it for university. I!I'm cyber security major.	3	9	2	8	3
The M key popped off during initial setup. Amazon is 2-day shipping me a replacement. Will update again when the new one lands.	3	7	3	8	3
Excellent computer!! For playing Minecraft or games!! A12 is a good GPU	3	2	1	8	7
Happy with it so far, def worth for the money.	4	6	3	8	3
This was a total rip off do not buy it. Said that there was 32GB there was only 29GB Available and it could not run without useing10GB	2	0	0	1	5
I never could get it to turn on, even after 6 hours of charging. Sent it back, and haven't had the nerve to replace it yet.	2	5	2	3	4
Easy to use and i love windows 10	4	6	3	8	3
so good so far	3	9	0	2	2
Exactly what I needed	3	1	0	0	2
Fan was making noise.	2	7	3	8	3
Very impressed with the quality for such a low price.	2	1	0	0	4
Not perfect but very solid and can serve multiple purposes	3	4	1	8	3
